,Compound,Date,Negative,Neutral,Positive,Tweet Text,Tweets Ago
0,0.8442,Tue Jun 19 21:15:16 +0000 2018,0.0,0.698,0.302,RT @DarkHorseComics: Have the courage to seek the wisdom that will grant you power. Today is the day: the Goddess Collection Triforce of bo…,1
1,0.6705,Tue Jun 19 18:01:18 +0000 2018,0.0,0.756,0.244,"RT @NintendoVS: Mario is a well-rounded fighter, with a variety of moves to handle any situation. In Super #SmashBrosUltimate, his Wedding…",2
2,-0.3561,Tue Jun 19 17:30:06 +0000 2018,0.125,0.813,0.062,Don't miss out! Save up to 50% on select #NintendoSwitch and Nintendo #3DS digital games. Ends 6/21 at 8:59am PT.… https://t.co/POgUgF0AyI,3
3,0.0,Tue Jun 19 17:00:07 +0000 2018,0.0,1.0,0.0,RT @RocketLeague: The Jurassic World Car Pack DLC is now LIVE on all platforms! Learn more about our latest Premium DLC at https://t.co/sIy…,4
4,0.7003,Tue Jun 19 16:30:22 +0000 2018,0.0,0.702,0.298,"In #MarioTennis Aces, your quest to save Luigi from the Legendary Racket features a huge variety of challenges. In… https://t.co/h40Q8voOy8",5
5,0.0,Mon Jun 18 21:46:53 +0000 2018,0.0,1.0,0.0,RT @RafaelNadal: Facing a new opponent. You might just recognise him… @NintendoEurope #MarioTennis https://t.co/CHK9Aied9l https://t.co/bGt…,6
6,0.8516,Mon Jun 18 16:00:02 +0000 2018,0.0,0.601,0.399,Celebrate #InternationalSushiDay by treating yourself to something fresh! Pair your favorite sushi dish with the fa… https://t.co/vSxMmUvChw,7
7,0.5859,Mon Jun 18 12:00:41 +0000 2018,0.0,0.847,0.153,Are you the ultimate Nintendo family? Enter to win the Nintendo Switch Family Showdown contest and be one of four f… https://t.co/Yg0Kli4RAJ,8
8,-0.4466,Sun Jun 17 17:16:50 +0000 2018,0.123,0.877,0.0,NO PURCH NECESSARY. U.S. &amp; Canada (excl. Quebec) residents only. Must be 13 or older. Enter by 3pm PT 6/22/18. See… https://t.co/26KIxNgE8v,9
9,0.4574,Sun Jun 17 17:15:44 +0000 2018,0.0,0.857,0.143,#NintendoMinute is back with a special behind-the-scenes look at #E32018! Watch the full episode and find out how t… https://t.co/4gvG4MHGP1,10
10,-0.1779,Sat Jun 16 21:21:29 +0000 2018,0.061,0.939,0.0,"RT @geoffkeighley: We both had crazy schedules this year, but in the last hour of @e3 2018, we made it happen: Geoff vs. Reggie in Mario Te…",11
11,0.918,Sat Jun 16 16:30:24 +0000 2018,0.0,0.563,0.437,RT @NintendoVS: #ARMS is celebrating its first anniversary! The developers would like to extend a very special thank you to all the fans fo…,12
12,0.8655,Sat Jun 16 16:00:10 +0000 2018,0.0,0.65,0.35,"This weekend in #SuperMarioRun, only Bowser items will appear in Remix 10's Super Bonus Game! This is your chance t… https://t.co/oNs5JIoRuk",13
13,0.8398,Sat Jun 16 15:00:06 +0000 2018,0.078,0.585,0.337,"Tempest Trials+: Feud of the Fangs has begun! The big rewards this time are a new 5★ Hero, Canas: Wisdom Seeker and… https://t.co/CKqoycT8g4",14
14,0.4404,Sat Jun 16 02:05:25 +0000 2018,0.0,0.707,0.293,"RT @GameStop: It’s an easy switch.
https://t.co/0FlheJQ5m8 https://t.co/miDoVvVLR6",15
15,0.784,Fri Jun 15 19:31:05 +0000 2018,0.0,0.712,0.288,"Hear from Reggie in a special #E32018 edition of #NintendoPower Podcast! Plus, a chat with the champion of the Supe… https://t.co/pw5itWtrIo",16
16,0.8544,Fri Jun 15 19:01:00 +0000 2018,0.0,0.67,0.33,"To celebrate the release of the Octo Expansion, #Splatoon2 producer Mr. Nogami drew this wonderful piece of artwork! https://t.co/rZEvzNXuwO",17
17,0.5994,Fri Jun 15 16:00:07 +0000 2018,0.0,0.813,0.187,Smash Bros. creator Mr. Sakurai poses with a few items from the new Super #SmashBrosUltimate in the #Nintendo… https://t.co/aW2UXWg4cq,18
18,0.0,Thu Jun 14 23:21:27 +0000 2018,0.0,1.0,0.0,https://t.co/nnzQl7Hhff,19
19,0.0,Thu Jun 14 21:53:54 +0000 2018,0.0,1.0,0.0,"RT @NISAmerica: With #Disgaea 1 Complete coming out on #NintendoSwitch this October 9th, the Netherworld is now bigger than ever before! Wh…",20
20,0.6696,Thu Jun 14 21:23:18 +0000 2018,0.0,0.766,0.234,That’s a wrap for Nintendo Treehouse: Live | #E32018! Thanks for watching and be sure to catch up on everything you… https://t.co/MWUhx8af7O,21
21,0.0,Thu Jun 14 20:31:38 +0000 2018,0.0,1.0,0.0,Get a look at live gameplay of #KillerQueenBlack and learn about what the new Black Team feature will bring to the… https://t.co/mtje4a7us6,22
22,0.5859,Thu Jun 14 20:15:03 +0000 2018,0.0,0.769,0.231,GAME FREAK’s Game Director Mr. Masuda is excited for everyone to play #PokemonLetsGo Pikachu and #PokemonLetsGo Eev… https://t.co/tS6dV6UIPP,23
23,0.5994,Thu Jun 14 20:01:06 +0000 2018,0.0,0.83,0.17,"RT @NintendoVS: Get a deep dive into some new moves for legendary Super #SmashBrosUltimate veterans, including Ganondorf, Link, and Zelda r…",24
24,0.0,Thu Jun 14 19:45:06 +0000 2018,0.0,1.0,0.0,The #OctopathTraveler Prologue Demo is available to download on #NintendoSwitch #eShop now! Start your journey as a… https://t.co/O2e0zYUgvn,25
25,-0.34,Thu Jun 14 19:27:59 +0000 2018,0.118,0.882,0.0,"Tune in to Nintendo Treehouse: Live | #E32018 for a look at deeper combat tactics, more details about jobs, skills,… https://t.co/9EWeomaaOI",26
26,0.0,Thu Jun 14 19:01:00 +0000 2018,0.0,1.0,0.0,"A new episode of #NintendoPower Podcast will be available tomorrow, recorded at #E32018! Reggie joins to talk about… https://t.co/BWL7xIii1E",27
27,0.0,Thu Jun 14 18:57:42 +0000 2018,0.0,1.0,0.0,Hit the courts with Nintendo Treehouse: Live | #E32018 as they show off two recently announced upcoming playable ch… https://t.co/NtcbEW412C,28
28,0.7096,Thu Jun 14 18:43:04 +0000 2018,0.0,0.763,0.237,"RT @NintendoVS: Get a look at Kirby’s new copy abilities, including Ridley and Inkling, in Super #SmashBrosUltimate right now on Nintendo T…",29
29,0.0,Thu Jun 14 18:08:17 +0000 2018,0.0,1.0,0.0,"Watch Nintendo Treehouse: Live | #E32018 now for a look at new minigames, a new mode, and a new board in Super… https://t.co/hN1YCyWvvu",30
30,0.6124,Thu Jun 14 17:55:29 +0000 2018,0.0,0.773,0.227,President Mr. Kimishima and new leader of Nintendo Mr. Furukawa are playing a friendly match of #MarioTennis Aces a… https://t.co/UcqgPJSXAB,31
31,0.0,Thu Jun 14 17:36:19 +0000 2018,0.0,1.0,0.0,"Get an in-depth look at #XenobladeChronicles2: Torna ~ The Golden Country, the brand-new Story Content Pack for Xen… https://t.co/NasZPqnvgv",32
32,-0.4466,Thu Jun 14 17:26:08 +0000 2018,0.134,0.866,0.0,"NO PURCH NEC. Open to residents of US/CAN (excl. Quebec), 13+. Deadline: 9:59am PT on 6/15/18. See rules @… https://t.co/yBIkurqOxY",33
33,0.7263,Thu Jun 14 17:25:30 +0000 2018,0.0,0.736,0.264,It’s the final day of the #MyNintendo Sweepstakes! Enter now for a chance to win a digital games package for… https://t.co/b0WQDP5V36,34
34,0.0,Thu Jun 14 17:10:11 +0000 2018,0.0,1.0,0.0,"Two players will head onto the court, but only one will emerge victorious. It’s Reggie Fils-Aime vs. Bill Trinen in… https://t.co/MENcYVIQVC",35
35,0.5994,Thu Jun 14 17:03:07 +0000 2018,0.0,0.837,0.163,"RT @NintendoVS: Tune in to Nintendo Treehouse: Live | #E32018 for a look at new Super #SmashBrosUltimate items, including new Pokémon and A…",36
36,0.5411,Thu Jun 14 16:45:05 +0000 2018,0.0,0.838,0.162,Save up to 50% on select #NintendoSwitch and Nintendo #3DS digital games now through 6/21 at 8:59am PT!… https://t.co/01w9Fp5jy4,37
37,-0.1531,Thu Jun 14 16:33:54 +0000 2018,0.201,0.67,0.129,The Producer and Creative Director of #Starlink: Battle for Atlas have stopped by Nintendo Treehouse: Live |… https://t.co/JUuHqnA8lq,38
38,0.0,Thu Jun 14 16:30:17 +0000 2018,0.0,1.0,0.0,"#ArcadeArchives Donkey Kong is the first-ever release of the complete arcade version outside of arcades, and it’s a… https://t.co/epF5QcbAw2",39
39,0.0,Thu Jun 14 16:26:18 +0000 2018,0.0,1.0,0.0,The arcade version of #SkySkipper is coming to North America for the first time! #ArcadeArchives Sky Skipper will b… https://t.co/KQLcJCSu7P,40
40,-0.1511,Thu Jun 14 16:00:41 +0000 2018,0.099,0.834,0.068,"You don’t want to miss the last day of Nintendo Treehouse: Live | #E32018, which starts right now!… https://t.co/3oSDsj9sgR",41
41,0.0,Thu Jun 14 15:34:05 +0000 2018,0.0,1.0,0.0,https://t.co/f8QBKw7sjE,42
42,0.1739,Thu Jun 14 03:00:08 +0000 2018,0.0,0.893,0.107,All aboard! The #Splatoon2: Octo Expansion DLC is available now on #NintendoSwitch #eShop! https://t.co/0gFQMy5zKf https://t.co/7tOhLtR8Y3,43
43,0.4389,Wed Jun 13 23:52:04 +0000 2018,0.0,0.822,0.178,Mr. Takahashi and Mr. Miyamoto take a break at #E32018 to play some #DonkeyKong Country: Tropical Freeze! How do yo… https://t.co/ysYW0d8E7S,44
44,0.3595,Wed Jun 13 23:35:51 +0000 2018,0.0,0.889,0.111,"That’s it for Nintendo Treehouse: Live | #E32018 today! Join us tomorrow at 9am PT with more live coverage, and cat… https://t.co/oGIwSkLicX",45
45,0.34,Wed Jun 13 22:24:44 +0000 2018,0.0,0.862,0.138,"Pre-purchase #OctopathTraveler on #NintendoSwitch #eShop today, and prepare to embark on eight new adventures when… https://t.co/NOxUIoOwMv",46
46,0.0,Wed Jun 13 22:01:11 +0000 2018,0.0,1.0,0.0,"Get a first look at live gameplay of #DaemonXMachina with Kenichiro Tsukuda, the Producer of the Armored Core serie… https://t.co/EoRmMy9rBV",47
47,0.0,Wed Jun 13 21:12:40 +0000 2018,0.0,1.0,0.0,Nintendo Treehouse: Live | #E32018 is showcasing a variety of mission types in #Splatoon2: Octo Expansion. Get your… https://t.co/oq6v5bg8Ui,48
48,0.0,Wed Jun 13 20:40:28 +0000 2018,0.0,1.0,0.0,Get a look at the first chapters for both H’aanit and Therion in #OctopathTraveler with Producer Masashi Takahashi… https://t.co/vNQBVvKbOq,49
49,0.5106,Wed Jun 13 20:26:20 +0000 2018,0.0,0.852,0.148,Koopa Troopa and Blooper will be coming to #MarioTennis Aces as playable characters via free software updates in Ju… https://t.co/eBUmICOPBm,50
50,0.6124,Wed Jun 13 20:02:11 +0000 2018,0.0,0.773,0.227,Tune in to Nintendo Treehouse: Live | #E32018 for a look at Adventure Mode in #MarioTennis Aces and a special annou… https://t.co/gir8RWHuzk,51
51,-0.69,Wed Jun 13 19:51:25 +0000 2018,0.24,0.678,0.081,RT @DoubleFine: We are excited to say that we’re working on bringing Grim Fandango Remastered and Broken Age to Nintendo Switch! #e32018 ht…,52
52,0.636,Wed Jun 13 19:39:33 +0000 2018,0.0,0.792,0.208,"RT @NintendoVS: Watch Nintendo Treehouse: Live | #E32018 showcase some of the fastest characters in Super #SmashBrosUltimate!
https://t.co/…",53
53,0.4926,Wed Jun 13 19:26:26 +0000 2018,0.0,0.842,0.158,Thanks to all the #Fortnite fans who've already helped build up over 2 million downloads on #NintendoSwitch! Still… https://t.co/3VWVc7mrzL,54
54,0.1531,Wed Jun 13 19:08:58 +0000 2018,0.114,0.746,0.14,Get an in-depth look at the brand-new world inspired by Donkey Kong’s legacy in #MarioRabbids Kingdom Battle: Donke… https://t.co/eHiAGBy01r,55
55,0.5719,Wed Jun 13 18:45:27 +0000 2018,0.0,0.821,0.179,#Splatoon2 producer Mr. Nogami is celebrating the upcoming release of the Splatoon 2: Octo Expansion here at… https://t.co/yK1zwkahYc,56
56,0.923,Wed Jun 13 18:32:30 +0000 2018,0.0,0.619,0.381,RT @NintendoVS: You can use all the Super Smash Bros. series #amiibo you know and love with Super #SmashBrosUltimate! Tagged amiibo will fu…,57
57,0.0,Wed Jun 13 18:24:06 +0000 2018,0.0,1.0,0.0,Get a guided tour of the Deepsea Metro in #Splatoon2: Octo Expansion with Mr. Nogami on Nintendo Treehouse: Live |… https://t.co/5oJNuhERiq,58
58,0.34,Wed Jun 13 18:00:28 +0000 2018,0.0,0.882,0.118,#HollowKnight for #NintendoSwitch is out now and Nintendo Treehouse: Live | #E32018 is giving you a first look at t… https://t.co/1KUolTOdZR,59
59,-0.4466,Wed Jun 13 17:42:07 +0000 2018,0.134,0.866,0.0,"NO PURCH NEC. Open to residents of US/CAN (excl. Quebec), 13+. Deadline: 9:59am PT on 6/14/18. See rules @… https://t.co/4JUCpKuVGk",60
60,0.7263,Wed Jun 13 17:41:22 +0000 2018,0.0,0.736,0.264,It’s Day 2 of the #MyNintendo Sweepstakes! Enter now for a chance to win the upcoming #MarioTennis Aces game for… https://t.co/jx2aPM43LN,61
61,0.784,Wed Jun 13 17:07:35 +0000 2018,0.0,0.699,0.301,"It’s a party on Nintendo Treehouse: Live | #E32018, a Super #MarioParty that is! Watch the first ever live gameplay… https://t.co/0pr02ye65C",62
62,0.0,Wed Jun 13 17:04:17 +0000 2018,0.0,1.0,0.0,"The Software Update 1.5.0 for #XenobladeChronicles2 will be available 6/14 at 10pm PT, and Expansion Pass owners wi… https://t.co/KcEqEIp9s7",63
63,0.0,Wed Jun 13 16:37:12 +0000 2018,0.0,1.0,0.0,"#XenobladeChronicles2 Expansion Pass owners will have access to two new playable Blades, Shulk and Fiora in Challen… https://t.co/v4umhFNtTA",64
64,0.0,Wed Jun 13 16:33:33 +0000 2018,0.0,1.0,0.0,Tune in to Nintendo Treehouse: Live | #E32018 right now to see the latest #XenobladeChronicles2 Expansion Pass news… https://t.co/aIWHbNJtNY,65
65,0.0,Wed Jun 13 16:01:10 +0000 2018,0.0,1.0,0.0,Nintendo Treehouse: Live | #E32018 is back with live gameplay highlighting new and returning techniques in Super… https://t.co/Z1p7aeLDDB,66
66,0.0,Wed Jun 13 15:30:30 +0000 2018,0.0,1.0,0.0,https://t.co/NISas9Mkux,67
67,0.0,Wed Jun 13 00:44:29 +0000 2018,0.0,1.0,0.0,RT @BestBuy: Which game are you going to add to your Nintendo Switch collection? https://t.co/jNsORqQUHt https://t.co/yJpx6Y7Msi,68
68,0.8353,Wed Jun 13 00:29:16 +0000 2018,0.0,0.727,0.273,RT @Konami: LIVE FROM E3! Konami is proud to present Hyper Sports R coming to the @NintendoAmerica Switch! Become the best competitor in a…,69
69,0.8555,Wed Jun 13 00:10:37 +0000 2018,0.0,0.615,0.385,Did you hear? Every fighter from previous Super Smash Bros. games will return in Super #SmashBrosUltimate on… https://t.co/kK9sGdONyt,70
70,0.9422,Tue Jun 12 23:49:07 +0000 2018,0.0,0.485,0.515,RT @NintendoVS: Congratulations to the two-time Super Smash Bros. Invitational champion @Zerowondering! And thanks to all our participants…,71
71,0.6588,Tue Jun 12 22:28:40 +0000 2018,0.0,0.732,0.268,Get a look at just some of the great games coming to #NintendoSwitch! https://t.co/rlOfCT6oqg,72
72,0.7901,Tue Jun 12 22:17:32 +0000 2018,0.0,0.75,0.25,"RT @galaxytrail: Freedom Planet is coming to the Nintendo Switch eShop this fall!

A big thank you to @XSEEDGames and @matpow2 for making t…",73
73,0.5994,Tue Jun 12 21:32:58 +0000 2018,0.0,0.837,0.163,RT @NintendoVS: All the Super #SmashBrosUltimate action is just getting started. We’re headed to Moray Towers from Splatoon for a doubles s…,74
74,0.8402,Tue Jun 12 21:23:43 +0000 2018,0.0,0.724,0.276,RT @NintendoVS: Our Super #SmashBros Invitational 2018 kicks off with doubles on the new Great Plateau Tower stage from The Legend of Zelda…,75
75,0.7712,Tue Jun 12 21:23:00 +0000 2018,0.0,0.74,0.26,RT @NintendoVS: It’s time. The Super #SmashBros Invitational 2018 is beginning now! The competitors are ready and our announcers are ready…,76
76,-0.5399,Tue Jun 12 21:15:06 +0000 2018,0.162,0.838,0.0,"Look out Inklings, there’s a new kid on the block! The #Splatoon2 Octoling #amiibo arrives as a 3-pack this year! https://t.co/i5KXdeTF4R",77
77,0.4574,Tue Jun 12 21:10:28 +0000 2018,0.0,0.85,0.15,The #Splatoon2: Octo Expansion will be available tomorrow evening! Help Agent 8 regain their memory as you explore… https://t.co/ZZthLG6r4t,78
78,0.3054,Tue Jun 12 21:08:36 +0000 2018,0.0,0.904,0.096,"RT @NintendoVS: Good news Inklings and Octolings! Previously we mentioned that #Splatoon2 game updates would end this July, but we are happ…",79
79,0.0,Tue Jun 12 20:37:14 +0000 2018,0.0,1.0,0.0,RT @BandaiNamcoUS: YOU'VE BEEN ASKING FOR IT! HERE...IT...IS! #DRAGONBALLFighterZ on the #NintendoSwitch is coming in 2018! https://t.co/KR…,80
80,-0.4466,Tue Jun 12 20:15:21 +0000 2018,0.134,0.866,0.0,"NO PURCH NEC. Open to residents of US/CAN (excl. Quebec), 13+. Deadline: 9:59am PT on 6/13/18. See rules @… https://t.co/WXneXgnqi3",81
81,0.7003,Tue Jun 12 20:14:33 +0000 2018,0.0,0.734,0.266,"Enter the #MyNintendo #E32018 Sweepstakes now for a chance to win a copy of #Splatoon2 for #NintendoSwitch, the Spl… https://t.co/P2RO8Wl77e",82
82,0.4912,Tue Jun 12 20:03:15 +0000 2018,0.063,0.749,0.188,RT @NintendoVS: The #Splatoon2 World Championship Finals are beginning now! You won’t want to miss these squid skills being put on display!…,83
83,0.3595,Tue Jun 12 20:00:47 +0000 2018,0.0,0.889,0.111,That’s it for today's Nintendo Treehouse: Live | #E32018! Join us tomorrow at 9am PT with more live coverage and st… https://t.co/qBvsBsqS3B,84
84,0.8016,Tue Jun 12 19:42:27 +0000 2018,0.0,0.676,0.324,RT @NintendoVS: See some sweet matchups in Super #SmashBrosUltimate on Nintendo Treehouse: Live | #E32018 right now! https://t.co/xYmEsIdBCy,85
85,0.128,Tue Jun 12 19:16:49 +0000 2018,0.0,0.927,0.073,"Get a look at #Overcooked2 and some of the new levels, mechanics, and an exclusive chef on Nintendo Treehouse: Live… https://t.co/JICnJcGqga",86
86,0.6249,Tue Jun 12 18:49:25 +0000 2018,0.123,0.593,0.285,"Venture down into a beautiful, ruined world of insects and heroes in #HollowKnight. Available now with all previous… https://t.co/WyH9CJvz0h",87
87,0.6996,Tue Jun 12 18:26:00 +0000 2018,0.0,0.775,0.225,"RT @NintendoVS: The official website for Super #SmashBrosUltimate is live! You can find footage and images for each fighter, a page to chec…",88
88,0.0,Tue Jun 12 18:18:30 +0000 2018,0.0,1.0,0.0,#Fortnite is available now for #NintendoSwitch and the crew from Nintendo Treehouse: Live | #E32018 can’t wait to d… https://t.co/ucDh5adaAG,89
89,0.4939,Tue Jun 12 17:53:35 +0000 2018,0.098,0.682,0.22,Are you ready to make the jump from the Battle Bus? #Fortnite is now available to download for free on… https://t.co/rlirrQmrMN,90
90,0.802,Tue Jun 12 17:36:09 +0000 2018,0.063,0.63,0.307,Did you miss the Super #SmashBrosUltimate portion of the Nintendo Direct: #E32018? The Super Smash Bros. Ultimate –… https://t.co/Ceknje07tT,91
91,0.0,Tue Jun 12 17:22:22 +0000 2018,0.0,1.0,0.0,Get a first look at live gameplay of the #PokemonLetsGo games and the #PokeBallPlus with Mr. Masuda right now on Ni… https://t.co/pIlY6EwNfq,92
92,0.6114,Tue Jun 12 17:00:09 +0000 2018,0.054,0.759,0.187,"New fighters are also coming to Super #SmashBrosUltimate! Splat your opponents with the Inkling, or smash your foes… https://t.co/FFjI0HygIE",93
93,0.6996,Tue Jun 12 16:52:28 +0000 2018,0.0,0.734,0.266,The gang’s all here! Every fighter from previous Smash Bros. games will return in Super #SmashBrosUltimate on… https://t.co/5mv8uxddaV,94
94,0.5994,Tue Jun 12 16:46:52 +0000 2018,0.0,0.804,0.196,Watch live gameplay of Super #SmashBrosUltimate with Game Director Mr. Sakurai on Nintendo Treehouse: Live |… https://t.co/SRiVZX0qlh,95
95,0.636,Tue Jun 12 16:43:32 +0000 2018,0.0,0.589,0.411,Super #SmashBrosUltimate arrives on #NintendoSwitch 12/7! https://t.co/bchHkeTOwy,96
96,0.0516,Tue Jun 12 16:17:00 +0000 2018,0.118,0.755,0.127,Eight characters. Eight stories. Whose dreams will you follow–and whose struggles will you overcome? See what dange… https://t.co/6F8TcggJus,97
97,0.128,Tue Jun 12 16:14:20 +0000 2018,0.0,0.914,0.086,"Square off with 2 teams of up to 4 players each as a console exclusive in the multiplayer phenomenon,… https://t.co/GAmfLvx0xN",98
98,0.0,Tue Jun 12 16:13:06 +0000 2018,0.0,1.0,0.0,"Prepare for the ultimate cook-off when #Overcooked2 comes to #NintendoSwitch on 8/7 with wireless, local, and onlin… https://t.co/PsI5DCl5Q4",99
99,0.0,Tue Jun 12 16:10:43 +0000 2018,0.0,1.0,0.0,#FireEmblem Three Houses for #NintendoSwitch arrives spring 2019! https://t.co/vLxqsDw6JB,100
100,0.784,Tue Jun 12 16:08:40 +0000 2018,0.0,0.615,0.385,Get the party started when Super #MarioParty comes to #NintendoSwitch on 10/5! https://t.co/bXYB1aredQ,101
101,0.296,Tue Jun 12 16:07:04 +0000 2018,0.0,0.891,0.109,The Mythical Pokémon Mew will come exclusively with every #PokeBallPlus and can join you on your journey through… https://t.co/DBo47N6emL,102
102,0.0,Tue Jun 12 16:05:42 +0000 2018,0.0,1.0,0.0,"#XenobladeChronicles2: Torna ~ The Golden Country, the brand-new Story Content Pack for Xenoblade Chronicles 2 Expa… https://t.co/784DM2Y1S7",103
103,0.0,Tue Jun 12 16:03:13 +0000 2018,0.0,1.0,0.0,#DaemonXMachina blasts onto #NintendoSwitch in 2019! https://t.co/yti2HcmAg8,104
104,0.0,Tue Jun 12 15:37:28 +0000 2018,0.0,1.0,0.0,https://t.co/xZypGjCKIt,105
105,0.7263,Tue Jun 12 00:58:18 +0000 2018,0.0,0.767,0.233,"RT @NintendoVS: And that’s a wrap for day 1 of the #Splatoon2 World Championship! Thanks to everyone for watching, and tune in tomorrow at…",106
106,0.5399,Mon Jun 11 22:31:44 +0000 2018,0.0,0.845,0.155,"RT @NintendoVS: Get hyped squid kids, because the #Splatoon2 World Championship is kicking off! Grab a Shwaffle and tune-in now!
https://t.…",107
107,0.0,Mon Jun 11 22:11:41 +0000 2018,0.0,1.0,0.0,https://t.co/VN61P0OmuV,108
108,0.0,Mon Jun 11 21:08:10 +0000 2018,0.0,1.0,0.0,RT @Ubisoft: The legendary Star Fox team are joining forces with the Star Link initiative &gt;&gt; https://t.co/Wi2wG3fkDP || #UbiE3 https://t.co…,109
109,0.4753,Mon Jun 11 20:50:22 +0000 2018,0.0,0.877,0.123,"RT @Ubisoft: 👏A round of applause for @grantkirkhope &amp; @CritHitBand! #UbiE3 

Get your hands on the Donkey Kong DLC for #MarioRabbids on Ju…",110
110,0.4926,Mon Jun 11 18:48:46 +0000 2018,0.0,0.873,0.127,"RT @NintendoVS: The stage is set! The #Splatoon2 World Championship kicks off today at 3:30pm PT. Which team are you booyah-ing for?

🇦🇺@Ye…",111
111,0.7579,Mon Jun 11 17:30:20 +0000 2018,0.158,0.491,0.351,"Build the perfect Vault, keep your Dwellers happy, and protect them from the dangers of the Wasteland in… https://t.co/plYJyZ9pYl",112
112,0.3802,Mon Jun 11 16:00:24 +0000 2018,0.0,0.89,0.11,Are you ready?! Make sure to tune in tomorrow at 9am PT for the Nintendo Direct: #E32018 to get a look at… https://t.co/rrVT1c6SQg,113
113,0.2481,Mon Jun 11 15:01:05 +0000 2018,0.197,0.568,0.235,Tap Battle: Illusory Dungeon - Legendary Heroes is here! Clear Tap Battle quests that become available from 12am PT… https://t.co/QrdK1C2QZn,114
114,0.8268,Sun Jun 10 17:00:00 +0000 2018,0.046,0.672,0.282,Congratulations to Rafael Nadal on his win in the French Open! Wonder what his toughest match was? Our bet is again… https://t.co/bOXrSL9GIH,115
115,0.636,Sun Jun 10 16:33:40 +0000 2018,0.0,0.827,0.173,BEAT THE E3 LINES! Be one of the very first to experience Super #SmashBros for #NintendoSwitch by reserving your ti… https://t.co/EQIyqS2d1D,116
116,0.5423,Sat Jun 09 15:00:02 +0000 2018,0.0,0.816,0.184,"Something fishy is going on and there’s only one thing to do about it. Grab a friend and challenge them anytime, an… https://t.co/V84jt4q4dc",117
117,0.8271,Fri Jun 08 20:33:49 +0000 2018,0.0,0.686,0.314,RT @NintendoVS: Going to #E32018? Reserve your ticket to play Super #SmashBros in the Nintendo booth. Secure your ticket online through Eve…,118
118,0.5574,Fri Jun 08 20:00:31 +0000 2018,0.0,0.753,0.247,Play #PokemonLetsGo Pikachu and #PokemonLetsGo Eevee on #NintendoSwitch with one Joy-Con controller. Share your oth… https://t.co/TLP6N1mKCQ,119
119,0.5423,Fri Jun 08 18:00:54 +0000 2018,0.0,0.816,0.184,"Each month there is a Special Orb Promo that anyone can purchase once a month in #FEHeroes. For June, on top of 21… https://t.co/8CiJDqmVMs",120
120,-0.25,Fri Jun 08 15:00:01 +0000 2018,0.091,0.909,0.0,"With 30+ different Sushi Sprites to collect, you’ll never have to eat (or fight) alone. #SushiStriker: The Way of S… https://t.co/mGkafmMJBM",121
121,-0.3595,Fri Jun 08 14:00:34 +0000 2018,0.111,0.889,0.0,"Today, the #FEHeroes ver. 2.6.0 will be distributed! In this update, accessories that can be worn by mini units wil… https://t.co/CSOko4xSNA",122
122,0.0,Fri Jun 08 03:00:00 +0000 2018,0.0,1.0,0.0,"Starting tomorrow, Nino: Pale Flower, Karla: Sword Vassal and Legault: The Hurricane will be a part of the new summ… https://t.co/mjF3Be9Bbh",123
123,0.0,Thu Jun 07 18:45:56 +0000 2018,0.0,1.0,0.0,"RT @BannerSaga: Today's the day, #nintendoswitch fans! Continue your saga as #BannerSaga 2 launches on #switch today! Get yours in the eSho…",124
124,0.75,Thu Jun 07 18:00:43 +0000 2018,0.0,0.727,0.273,"The Poké Ball Plus is the perfect way to play #PokemonLetsGo Pikachu &amp; #PokemonLetsGo Eevee! With motion controls,… https://t.co/gLpNe9camn",125
125,0.0,Thu Jun 07 17:00:28 +0000 2018,0.0,1.0,0.0,You’ll have to put all your #Splatoon2 skills to the test in the Splatoon 2: Octo Expansion! Try not to fall off th… https://t.co/fNg38eHSmn,126
126,0.0,Thu Jun 07 15:00:01 +0000 2018,0.0,1.0,0.0,Paladins is coming to #NintendoSwitch! Experience the fantasy team-based shooter at home or on the go. Become a Fou… https://t.co/VHqWQN947F,127
127,0.0,Thu Jun 07 12:00:00 +0000 2018,0.0,1.0,0.0,Mario and Rafael Nadal are going head-to-head in the match of the century! Check out the brand new trailer for… https://t.co/Zd7LZHPVss,128
128,0.636,Thu Jun 07 01:30:04 +0000 2018,0.0,0.809,0.191,The latest Hint Art is in! Use the hint in this image to help you find where treasure is buried. Do a Ground Pound… https://t.co/BBt0dPydfP,129
129,0.8687,Wed Jun 06 20:40:35 +0000 2018,0.0,0.671,0.329,RT @NintendoVS: We're welcoming some special guests to take part in the action at the Super #SmashBros Invitational 2018! Check out a few o…,130
130,0.2481,Wed Jun 06 18:00:00 +0000 2018,0.112,0.698,0.19,Make sure your sushi attacks are in stereo with the Sushi Sprite Kumaten! Its Double Shot ability makes your attack… https://t.co/WXlIYItUWP,131
131,-0.7712,Wed Jun 06 17:30:00 +0000 2018,0.26,0.74,0.0,"Dark Meta Knight's mirrors work in a variety of ways, they can even reflect enemy attacks right back at them! Give… https://t.co/sIwusDOzoN",132
132,-0.6369,Wed Jun 06 17:00:27 +0000 2018,0.215,0.785,0.0,Applying pressure on your foes is key to victory in #MarioTennis Aces. Keep them on their toes by slamming a hard-h… https://t.co/OpZMjTFeb9,133
