,Compound,Date,Negative,Neutral,Positive,Tweet Text,Tweets Ago
2349,0.0,Wed Apr 12 22:34:05 +0000 2017,0.0,1.0,0.0,"It’s a scientific fact that new #Splatoon2 series amiibo figures will be released – Inkling Girl, Inkling Boy, and… https://t.co/m7sgBcov3K",2350
2350,0.4753,Wed Apr 12 22:30:39 +0000 2017,0.0,0.853,0.147,Power Egg collecting is becoming popular among Inklings! Experience it in the new Salmon Run mode in #Splatoon2. https://t.co/mW0YfrawOv,2351
2351,-0.2942,Wed Apr 12 22:28:13 +0000 2017,0.144,0.856,0.0,Limited quantities of the standalone #NintendoSwitch dock will be available for purchase May 19th!,2352
2352,0.34,Wed Apr 12 22:28:02 +0000 2017,0.0,0.862,0.138,"Play PAC-MAN, GALAGA, SPLATTERHOUSE + more, anytime, anywhere, when NAMCO MUSEUM comes to Nintendo eShop on… https://t.co/zOo2VFOz7v",2353
2353,-0.4939,Wed Apr 12 22:27:21 +0000 2017,0.147,0.798,0.055,Get paid to be the bad guys in the intense four-player co-op action game PAYDAY 2. Open the vault on… https://t.co/X7dHyAfEKs,2354
2354,0.2023,Wed Apr 12 22:26:23 +0000 2017,0.102,0.763,0.136,Diesel-punk shoot ‘em up Sine Mora EX is a stirring tale of honor and morality launching on #NintendoSwitch this su… https://t.co/K7okRWYM6N,2355
2355,0.0,Wed Apr 12 22:25:59 +0000 2017,0.0,1.0,0.0,Rayman Legends: Definitive Edition is the ultimate version of the award-winning game launching later this year on… https://t.co/ygpnYrpN7t,2356
2356,0.0,Wed Apr 12 22:24:39 +0000 2017,0.0,1.0,0.0,"A Puyo Puyo Tetris demo will be on the #eShop shortly, and will give you a taste of both the Solo &amp; Multiplayer Arc… https://t.co/MRvnbQo5Xy",2357
2357,0.0,Wed Apr 12 22:24:14 +0000 2017,0.0,1.0,0.0,Two famous puzzle games face off in the 4-player puzzle mash-up game Puyo Puyo Tetris launching April 25 on… https://t.co/yzI3oeWHGK,2358
2358,-0.2263,Wed Apr 12 22:23:43 +0000 2017,0.106,0.894,0.0,Explore the Netherworlds in Disgaea 5 Complete when the standard and limited editions launch on #NintendoSwitch May… https://t.co/06BzQRfgOB,2359
2359,0.0,Wed Apr 12 22:23:10 +0000 2017,0.0,1.0,0.0,Fate/Extella is headed to #NintendoSwitch with more than 30+ DLC outfits included and launches on July 25. https://t.co/GRDCfWVK7y,2360
2360,-0.6808,Wed Apr 12 22:21:44 +0000 2017,0.18,0.82,0.0,"The world hangs in the clutches of Eggman, but 2 Sonics are here to face the danger in Sonic Forces, racing to… https://t.co/h3I9uSv9gh",2361
2361,0.5994,Wed Apr 12 22:20:44 +0000 2017,0.0,0.822,0.178,"Minecraft: Nintendo Switch Edition, including the Super Mario Mash-Up pack, will launch in Nintendo #eShop on May 1… https://t.co/sBdJnXSHlk",2362
2362,-0.3164,Wed Apr 12 22:19:46 +0000 2017,0.135,0.791,0.074,"Take the fight with you and throw down wherever, whenever, in Ultra Street Fighter II on #NintendoSwitch! Releasing… https://t.co/ACn4ldUHrw",2363
2363,0.5719,Wed Apr 12 22:18:41 +0000 2017,0.0,0.837,0.163,We’ll be hosting two tournaments to celebrate the launch of #MarioKart 8 Deluxe. Stay tuned for more info when the… https://t.co/auHmRyWofv,2364
2364,0.0,Wed Apr 12 22:17:28 +0000 2017,0.0,1.0,0.0,"Alongside the launch of #ARMS, the new Neon Yellow colored Joy-Con and Joy-Con strap will be available! https://t.co/oFmMznYYWi",2365
2365,-0.3612,Wed Apr 12 22:17:10 +0000 2017,0.152,0.848,0.0,Stretch the limits of your fighting skills when #ARMS launches June 16 on #NintendoSwitch. https://t.co/b61yhqdp9f,2366
2366,0.3802,Wed Apr 12 22:16:55 +0000 2017,0.0,0.755,0.245,Increase the rivalry in #ARMS with 2 vs. 2 action! https://t.co/GWdeNCmKDm,2367
2367,-0.3164,Wed Apr 12 22:12:49 +0000 2017,0.125,0.807,0.067,Introducing the newest contender to #ARMS - the fighting noodle girl Min Min! She can knock down an opponent’s arms… https://t.co/Zaybur8IVH,2368
2368,0.75,Wed Apr 12 22:09:53 +0000 2017,0.0,0.758,0.242,"The final amiibo figures in the Super Smash Bros. series are on the way! Cloud, Corrin and Bayonetta join the fight… https://t.co/pUn22eBsiR",2369
2369,0.0,Wed Apr 12 22:09:41 +0000 2017,0.0,1.0,0.0,"Three new #Zelda amiibo figures will be released on June 23rd: Majora's Mask Link, Twilight Princess Link and Skywa… https://t.co/hMsvMVA5UZ",2370
2370,0.0,Wed Apr 12 22:09:28 +0000 2017,0.0,1.0,0.0,"Download a demo for all three BOXBOY! games in the #eShop today, and check out https://t.co/fKd1wbBhws for more info.",2371
2371,0.0,Wed Apr 12 22:09:21 +0000 2017,0.0,1.0,0.0,"Discover new puzzles, hazards &amp; Qbabies in BYE-BYE BOXBOY!, the latest game from the creators of Kirby. Launching t… https://t.co/Rngw1L49hu",2372
2372,-0.3164,Wed Apr 12 22:08:12 +0000 2017,0.123,0.809,0.068,"Kirby’s Blowout Blast is also headed to the #3DS! Fight through 25+ stages of challenging 3D worlds this summer, ex… https://t.co/ZVM0NI3jTu",2373
2373,0.0,Wed Apr 12 22:07:27 +0000 2017,0.0,1.0,0.0,"Team Kirby Clash Deluxe is a free-to-start game for Nintendo #3DS, and you can get started right away when it launc… https://t.co/y20weIuXhN",2374
2374,-0.34,Wed Apr 12 22:06:51 +0000 2017,0.118,0.882,0.0,Fire Emblem Echoes: Shadows of Valentia will have DLC that can be purchased individually or through a Season Pass. https://t.co/uJOuy1E130,2375
2375,0.6369,Wed Apr 12 22:06:12 +0000 2017,0.0,0.766,0.234,"In Miitopia, create Mii characters of your friends &amp; family for a customized RPG experience, when the game launches… https://t.co/gLT9lk9jDb",2376
2376,0.34,Wed Apr 12 22:05:07 +0000 2017,0.075,0.754,0.171,Create and share infinite amount of tales in RPG Maker Fes when the standard and limited editions launch on June 27… https://t.co/YeCR9R1gqq,2377
2377,0.6114,Wed Apr 12 22:04:30 +0000 2017,0.0,0.818,0.182,The Culdcept series is celebrating its 20th anniversary! Culdcept Revolt launches on 8/29 for #3DS in both standard… https://t.co/AKnwCvVv6r,2378
2378,0.0,Wed Apr 12 22:04:06 +0000 2017,0.0,1.0,0.0,"YO-KAI WATCH 2: Psychic Specters, the definitive version of YO-KAI WATCH 2, releases Fall 2017. https://t.co/ZFW4oH2Zhx",2379
2379,0.3612,Wed Apr 12 22:03:15 +0000 2017,0.0,0.872,0.128,Get ready for a new turn-based RPG unlike anything the @MonsterHunter series has seen before. Monster Hunter Storie… https://t.co/IMhJLtnR1C,2380
2380,0.1779,Wed Apr 12 22:02:28 +0000 2017,0.0,0.918,0.082,"Work with Water Spirit Esna to defend the world’s last Oasis in Ever Oasis, releasing June 23 on #3DS. https://t.co/aL8utAilyx",2381
2381,0.0,Wed Apr 12 22:01:35 +0000 2017,0.0,1.0,0.0,The new Pikmin amiibo figure will be released the same day as Hey! Pikmin on July 28. https://t.co/Fiq9mhDNIQ,2382
2382,0.0,Wed Apr 12 22:01:20 +0000 2017,0.0,1.0,0.0,"Captain Olimar is back in Hey! Pikmin, landing on the Nintendo #3DS family of systems July 28. https://t.co/QHajSbL1P1",2383
2383,0.0,Wed Apr 12 22:00:07 +0000 2017,0.0,1.0,0.0,"Tune in to the Nintendo Direct, starting now! https://t.co/FCSkNORotz https://t.co/Ky0VY1RZm2",2384
2384,0.0,Wed Apr 12 15:01:27 +0000 2017,0.0,1.0,0.0,Time's almost up to get the Cherry Blossom Tree during the Gold Goomba Mega Event! #SuperMarioRun. Ends April 12 at… https://t.co/b50Vn7JU1i,2385
2385,0.6588,Wed Apr 12 07:15:05 +0000 2017,0.0,0.827,0.173,"Total score in the 2nd #FEHeroes Voting Gauntlet passed 10 bn points! All players get 20 Orbs, 5 of each Great Badg… https://t.co/3mv4LicHkz",2386
2386,0.9311,Wed Apr 12 07:12:01 +0000 2017,0.0,0.502,0.498,"Ver 1.2.0 includes Sacred Seals plus Hero Merit, Swap Spaces, EXP gain increase, more stamina, notification changes - and more! #FEHeroes",2387
2387,0.7506,Wed Apr 12 07:10:04 +0000 2017,0.0,0.726,0.274,"To celebrate the new Sacred Seals feature, special quests have been added. There's a daily 2 Orb Sacred Seals Log-I… https://t.co/Hu360IzDxO",2388
2388,0.802,Wed Apr 12 07:07:01 +0000 2017,0.0,0.753,0.247,You can't own duplicate Sacred Seals. Doubles convert to Hero Feathers. Each Hero can equip 1 seal and can change it at any time. #FEHeroes,2389
2389,0.5562,Wed Apr 12 07:05:04 +0000 2017,0.0,0.854,0.146,"Power up your Heroes with Sacred Seals, now available in #FEHeroes! In the future, you'll be able to earn them from… https://t.co/rxbptHbY31",2390
2390,0.0,Tue Apr 11 19:00:04 +0000 2017,0.0,1.0,0.0,"Spring is here, and so is National StreetPass Weekend! https://t.co/5tvaRBNRin https://t.co/Rz88ot8mZg",2391
2391,0.9117,Tue Apr 11 17:30:04 +0000 2017,0.0,0.588,0.412,"The winner of the 2nd Voting Gauntlet is Camilla! Rewards are ready, and we hope you look forward to the next… https://t.co/6PyY279aWu",2392
2392,0.4003,Tue Apr 11 17:00:04 +0000 2017,0.0,0.748,0.252,GOOOOOAL! It’s time to play soccer in #MarioSportsSuperstars. https://t.co/SzaDx2aMO2,2393
2393,0.555,Tue Apr 11 15:00:03 +0000 2017,0.0,0.854,0.146,Time's almost up to get all the prizes from the Mega Event! Gold Goombas! in #SuperMarioRun. Ends April 13 at 11:59… https://t.co/gdvESzohIK,2394
2394,0.6114,Mon Apr 10 18:02:19 +0000 2017,0.0,0.778,0.222,"Celebrate #MarioKart 8 Deluxe with fan-favorite, King Boo! Just watch out for those red shells. https://t.co/IJxSdn5Fbf",2395
2395,0.34,Mon Apr 10 17:30:07 +0000 2017,0.0,0.805,0.195,Billings Farm sent the challenge and Nintendo accepted. Now find out who won… #12Switch #NintendoSwitch https://t.co/sQ8ljvCcEH,2396
2396,0.6114,Mon Apr 10 17:00:15 +0000 2017,0.0,0.81,0.19,RT @nicalis: Isaac is going for a second run on #NintendoSwitch and to celebrate he's got a new look! https://t.co/dbEpXhOtav,2397
2397,0.0,Mon Apr 10 14:00:05 +0000 2017,0.0,1.0,0.0,Nintendo Direct incoming! Tune in 4/12 at 3 PM PT. https://t.co/SFHXEaFQIc,2398
2398,0.7712,Thu Apr 06 20:07:40 +0000 2017,0.0,0.691,0.309,"From one Universal attraction to another - congrats on the opening of Race Through New York, @jimmyfallon! https://t.co/5UZM1p4UWR",2399
2399,0.5411,Thu Apr 06 17:30:07 +0000 2017,0.0,0.838,0.162,Did anyone else notice the adorable furry creature seen in the recent #Splatoon2 #Testfire event? Meet Li’l Judd! https://t.co/h9dfC2oKmR,2400
2400,0.6249,Thu Apr 06 17:00:07 +0000 2017,0.0,0.733,0.267,Create your own golf tournament starring some of your favorite Nintendo characters in #MarioSportsSuperstars for… https://t.co/wMv6MMcGVp,2401
2401,0.9336,Thu Apr 06 16:30:04 +0000 2017,0.0,0.561,0.439,The last daily log-in bonus for #SuperMarioRun is a Super Star statue! This bonus will be in your Gift Box until 11… https://t.co/BmFZqmEtpa,2402
2402,0.25,Thu Apr 06 07:00:03 +0000 2017,0.0,0.895,0.105,Post #Miitomo 1st anniversary themed Miifotos to Twitter for a chance to be featured in a Miifoto mosaic. Details:… https://t.co/wjqHbLsOYI,2403
2403,0.0258,Wed Apr 05 21:35:04 +0000 2017,0.121,0.754,0.126,Get ready for Fire Emblem Echoes: Shadows of Valentia with a digital wallpaper available now on #MyNintendo.… https://t.co/SP2A5Hmq6K,2404
2404,-0.6239,Wed Apr 05 21:30:03 +0000 2017,0.241,0.759,0.0,Get 30% off Fire Emblem Fates: Birthright for #3DS + other classic Fire Emblem games using #MyNintendo points!… https://t.co/yYGYgnjc3X,2405
2405,0.5423,Wed Apr 05 20:20:37 +0000 2017,0.0,0.769,0.231,"Join the Chase in LEGO CITY Undercover, the open-world LEGO adventure game avaliable now on #NintendoSwitch.… https://t.co/HujhJrCT0N",2406
2406,0.6588,Wed Apr 05 07:06:00 +0000 2017,0.0,0.845,0.155,"#FEHeroes Voting Gauntlet - Aim for 10 billion! If overall score is 10 bn+ you get 20 Orbs, 5 of each Great Badge, &amp; 5000 Universal Crystals",2407
2407,0.0,Wed Apr 05 07:05:00 +0000 2017,0.0,1.0,0.0,"The 2nd #FEHeroes Voting Gauntlet has begun! Round 1 runs 45 hrs from 4/5, 12AM PT to 4/6, 8:59PM PT. Vote for your… https://t.co/WAynsv46Mr",2408
2408,-0.0258,Tue Apr 04 07:05:06 +0000 2017,0.111,0.783,0.106,A skilled swordman known as Scarlet Sword is from Fire Emblem: Mystery of the Emblem. He's cool and taciturn. https://t.co/eoB12Y0px3,2409
2409,0.7424,Tue Apr 04 07:05:03 +0000 2017,0.095,0.582,0.323,"#FEHeroes Grand Hero Battle against Navarre: Scarlet Sword starts today! This is your chance to pick up a 4★ Hero,… https://t.co/UBi7anL7Pv",2410
2410,0.6369,Mon Apr 03 19:06:05 +0000 2017,0.096,0.64,0.264,"RT @GooglePlay: Tweet your two fav emojis + #GooglePlayEmojiSummon and summon a hero.

Which 🔥  #FEHeroes character did you get? https://t.…",2411
2411,0.2003,Mon Apr 03 18:00:03 +0000 2017,0.144,0.676,0.18,Some players steal bases … Bowser kidnaps them! Celebrate the first day of baseball with #MarioSportsSuperstars on… https://t.co/Rht5Se36nB,2412
2412,0.7003,Mon Apr 03 17:35:02 +0000 2017,0.0,0.746,0.254,#FEHeroes Voting Gauntlet Changes: Special quests will change when Round 2 and the Final Round begin. Rewards have been adjusted.,2413
2413,0.0,Mon Apr 03 17:30:15 +0000 2017,0.0,1.0,0.0,The 2nd #FEHeroes Voting Gauntlet starts 4/5 at 12AM PT. This time it's Wyvern Riders vs. Pegasus Knights! Who will… https://t.co/oMDcze1p8g,2414
2414,0.4215,Sun Apr 02 18:00:25 +0000 2017,0.0,0.872,0.128,"Gold Goombas Tip #2: The further through World Tour you go, the easier it is to encounter a Gold Goomba.… https://t.co/n6OzPgvoKL",2415
2415,0.0,Sat Apr 01 17:01:14 +0000 2017,0.0,1.0,0.0,Gold Goombas Tip #1: Clearing any World Tour course will change where a Gold Goomba will appear. #SuperMarioRun https://t.co/opOHi3bpZD,2416
2416,0.0,Sat Apr 01 15:00:08 +0000 2017,0.0,1.0,0.0,Introducing Humpback Pump Track. This new #Splatoon2 stage is an indoor BMX track featuring curvy ups &amp; downs and..… https://t.co/r2Y132dwaA,2417
2417,0.3786,Fri Mar 31 20:00:43 +0000 2017,0.0,0.88,0.12,The Miitomo Outfit Design Contest is on! Design an outfit for a chance to have it featured in #Miitomo! Details:… https://t.co/R2SQ1Sso3V,2418
2418,0.0,Fri Mar 31 17:00:21 +0000 2017,0.0,1.0,0.0,"Game, set &amp; match! Show off your tennis skills now in #MarioSportsSuperstars. https://t.co/wVtkkJhcXP",2419
2419,0.7263,Fri Mar 31 16:30:10 +0000 2017,0.0,0.767,0.233,Log in to #SuperMarioRun daily and receive in-game items! New items added daily to your Gift Box. Today’s gift is a… https://t.co/CNh7dGYRRP,2420
2420,0.4215,Fri Mar 31 07:05:13 +0000 2017,0.0,0.877,0.123,"This month, the Choose Your Legends event 2nd place finishers Roy and Lucina grace the new calendar wallpaper for A… https://t.co/aw0pDCzbcI",2421
2421,0.6351,Fri Mar 31 02:00:04 +0000 2017,0.0,0.802,0.198,"The #Miitomo 1st anniversary event is on! 1st anniversary items, login bonuses, contests, and more! Details here:… https://t.co/ps7cMAgFfM",2422
2422,0.6696,Thu Mar 30 16:30:10 +0000 2017,0.0,0.776,0.224,Complete stamp cards during the Gold Goomba event to obtain special items like Piranha Plant statue and more! The e… https://t.co/ZcFRq5vQut,2423
2423,0.7263,Thu Mar 30 15:00:48 +0000 2017,0.0,0.757,0.243,ATTN Inklings: Assemble your team &amp; enter the #Splatoon US Inkling Open for a chance to win a trip to #E32017! Visi… https://t.co/kEz6tr7UHo,2424
2424,0.4574,Thu Mar 30 07:05:03 +0000 2017,0.0,0.87,0.13,"Xander, Camilla, Chrom and Lucina are now part of a 5★ Focus! There are also paralogue maps and special quests with… https://t.co/bLNz4w3IGV",2425
2425,0.5255,Wed Mar 29 20:00:50 +0000 2017,0.0,0.805,0.195,"Sharpen your strategy skills with #HasBeenHeroes from our friends @Frozenbyte, available now on #NintendoSwitch!… https://t.co/lpDSpgIW0X",2426
2426,0.3382,Wed Mar 29 19:29:55 +0000 2017,0.0,0.888,0.112,Billings Farm sent the challenge... And Nintendo accepted! Check out highlights from the farm and stay tuned to fin… https://t.co/cfgXoZNrlM,2427
2427,0.0,Wed Mar 29 17:15:34 +0000 2017,0.0,1.0,0.0,"Snake Pass has slithered its way onto #NintendoSwitch, available now! https://t.co/LI1e5aGwu0 https://t.co/D8WQjLATYs",2428
2428,0.0,Wed Mar 29 16:46:32 +0000 2017,0.0,1.0,0.0,Mario &amp; Luigi are still shipping out #NintendoSwitch consoles! Check with your local retailers over the next few da… https://t.co/ILJIVwcstp,2429
2429,0.7263,Wed Mar 29 16:01:56 +0000 2017,0.0,0.767,0.233,Log in to #SuperMarioRun daily and receive in-game items! New items added daily to your Gift Box. Today’s gift is R… https://t.co/qJlszMnODb,2430
2430,0.5972,Wed Mar 29 07:05:01 +0000 2017,0.0,0.837,0.163,"New Heroes arrive at 12AM PT on 3/30! Chrom, Lucina, Xander and Camilla…in bunny outfits! Plus paralogue maps and s… https://t.co/gBTTKlWhmj",2431
2431,-0.2263,Wed Mar 29 00:02:26 +0000 2017,0.095,0.905,0.0,"RT @BestBuy: 3/29.
Noon CT.
Limited quantities of the #NintendoSwitch and NES Classic will be available online.
@NintendoAmerica https://t.…",2432
2432,0.6951,Tue Mar 28 22:30:02 +0000 2017,0.098,0.609,0.293,"RT @GooglePlay: Attacks from @Android’s exclusive giveaway character Corrin are so satisfying 😈

Try it out ⏪👆⏩ 
#FEHeroes https://t.co/BqF…",2433
2433,0.8516,Tue Mar 28 21:30:16 +0000 2017,0.0,0.66,0.34,"New Heroes are coming 3/30—wearing special outfits! Can you figure out who they are? They're cute, and they'll be h… https://t.co/UVqrJc4xHw",2434
2434,0.0,Tue Mar 28 19:00:44 +0000 2017,0.0,1.0,0.0,The Farmer vs. The Gamer… It’s on! #NintendoSwitch #12Switch https://t.co/GTEY9MOHqW,2435
2435,0.0772,Tue Mar 28 17:30:27 +0000 2017,0.0,0.925,0.075,Reggie challenges you to amp up your game of #12Switch. Check out more details here: https://t.co/zBbcyrEfTr… https://t.co/rYx01LPB0E,2436
2436,0.0,Tue Mar 28 17:00:21 +0000 2017,0.0,1.0,0.0,"Swing for a birdie in #MarioSportsSuperstars, now available for the Nintendo 3DS family of systems! https://t.co/scAfIJHtpa",2437
2437,-0.0772,Tue Mar 28 16:09:24 +0000 2017,0.127,0.759,0.114,Defeat Gold Goombas in the World Tour and receive stamps for your stamp cards to get special items in… https://t.co/zbcIRxH5dO,2438
2438,0.3802,Mon Mar 27 21:30:04 +0000 2017,0.0,0.885,0.115,"Once you beat World 1-4 in #SuperMarioRun, it’ll increase Toad Rally courses! Red, Blue and Green Toad will also co… https://t.co/uerChfaZQn",2439
2439,0.0,Mon Mar 27 20:37:24 +0000 2017,0.0,1.0,0.0,The Nintendo #3DS came out 6 years ago today! Can you name the other launch titles that released with it? https://t.co/rg1mwo1yYb,2440
2440,0.2714,Mon Mar 27 19:05:03 +0000 2017,0.087,0.777,0.137,"For a limited time, get the special Fireworks Cannon building in the #SuperMarioRun shop! Available till April 24 a… https://t.co/Q3QXmdEDrc",2441
2441,0.8016,Mon Mar 27 18:50:07 +0000 2017,0.0,0.69,0.31,Celebrate 5 yrs of Kid Icarus™: Uprising w/ #MyNintendo! Redeem points for animated episodes inspired by the series… https://t.co/waoe2gcSM7,2442
2442,0.7177,Mon Mar 27 16:30:57 +0000 2017,0.0,0.75,0.25,"More content added to free version, new playable characters added &amp; the Android version is available in Google Play! https://t.co/eevqqEgmLX",2443
2443,0.6114,Sat Mar 25 17:09:59 +0000 2017,0.0,0.693,0.307,Celebrate the first weekend of spring outdoors with #12Switch! https://t.co/AljDjes1Y7,2444
2444,-0.25,Sat Mar 25 16:50:42 +0000 2017,0.131,0.795,0.074,"RT @AppStore: Unlock the face-to-face Bowser confrontation in World 1-4 with Bowser's Challenge. #SuperMarioRun 
https://t.co/Y6W7X12704 ht…",2445
2445,-0.1759,Fri Mar 24 23:31:27 +0000 2017,0.086,0.914,0.0,RT @ImageForm: Check out #NintendoMinute for lots of #SWD2 gameplay and funky robot shenanigans! Live now on https://t.co/yciRdDMO2V @Ninte…,2446
2446,0.6229,Fri Mar 24 19:02:28 +0000 2017,0.0,0.789,0.211,Calling all Inklings! The #Splatoon2 Global #Testfire is now live! Be sure to use the capture button to share your… https://t.co/9IKB4F22Pe,2447
2447,0.0,Fri Mar 24 19:01:08 +0000 2017,0.0,1.0,0.0,Tune in now to check out the #Splatoon2 Global #Testfire with Nintendo’s Treehouse. https://t.co/AaAcTks1Cv https://t.co/dH06tObEkK,2448
2448,0.1511,Fri Mar 24 17:30:34 +0000 2017,0.0,0.914,0.086,"RT @AppStore: Unlock World 1-4 in #SuperMarioRun today! Just complete one of Bowser’s new challenges. 🍄🏰🍄 
https://t.co/Y6W7X12704 https://…",2449
2449,0.34,Fri Mar 24 17:07:07 +0000 2017,0.0,0.888,0.112,"Which of the five sports in the #MarioSportsSuperstars game are you going to play first? Baseball, Tennis, Golf, So… https://t.co/EaTd1TWZlj",2450
2450,0.0,Fri Mar 24 16:40:19 +0000 2017,0.0,1.0,0.0,"RT @AppStore: Because one Yoshi is never enough, #SuperMarioRun has four more. 💛💙💚💜❤️ 
https://t.co/Y6W7X12704 https://t.co/fosVVqXrA5",2451
2451,0.6688,Fri Mar 24 16:33:23 +0000 2017,0.0,0.817,0.183,"RT @GooglePlay: Super Mario Run is officially available on @Android!

Go all out and never look back! 🏃 
https://t.co/Pho51gplL0 https://t.…",2452
2452,0.0,Fri Mar 24 16:01:39 +0000 2017,0.0,1.0,0.0,Mario and Luigi have been busy shipping out more #NintendoSwitch consoles! Check with your local retailers this wee… https://t.co/f0dF9BeGLN,2453
2453,0.9108,Fri Mar 24 07:05:05 +0000 2017,0.075,0.489,0.436,A #FEHeroes Grand Hero Battle has begun! Clear it and gain Michalis as an ally. Jump on this chance and make a 3★ H… https://t.co/tLiTwd5Yw4,2454
2454,0.7345,Thu Mar 23 19:02:18 +0000 2017,0.0,0.708,0.292,Attention squid lovers! Get ready to get your splat on in the #Splatoon2 Global #Testfire tomorrow. https://t.co/q7dghf7fPq,2455
2455,0.7901,Thu Mar 23 18:37:46 +0000 2017,0.0,0.696,0.304,Nothing beats befriending your favorite pupper in The Legend of #Zelda: Breath of the Wild. Happy #NationalPuppyDay! https://t.co/Lo3HvGTzsX,2456
2456,-0.2714,Thu Mar 23 07:05:04 +0000 2017,0.231,0.518,0.251,"Advanced summoners, take note of the new #FEHeroes Lunatic Challenge special quests! Even on the lowest difficulty,… https://t.co/Vy71DVSBkr",2457
2457,0.3612,Wed Mar 22 21:53:31 +0000 2017,0.0,0.828,0.172,Gearing up for the #Splatoon2 #Testfire in two days. Are you ready? https://t.co/XSUgaGMwSA,2458
2458,0.4003,Wed Mar 22 21:33:08 +0000 2017,0.0,0.839,0.161,We've released #SuperMarioRun on Android a bit early! Download it now on Google Play: https://t.co/u4H9bycTyr https://t.co/4nHnPWD9de,2459
2459,0.3382,Wed Mar 22 21:00:06 +0000 2017,0.0,0.883,0.117,Musselforge Fitness will be one of two maps in rotation during the #Splatoon2 Global #Testfire. Only 2 days left! https://t.co/KZoJjUm42n,2460
2460,0.0,Wed Mar 22 20:06:04 +0000 2017,0.0,1.0,0.0,"You’re right, because each way is possible! Try coming up with your own in #Snipperclips, now available on… https://t.co/07QWkJpNgL",2461
2461,0.5661,Wed Mar 22 18:46:36 +0000 2017,0.0,0.774,0.226,Ready for another #Snipperclips brain buster? Which strategy do you think will work to solve this one? https://t.co/vn5ipGT1DV,2462
2462,0.1511,Wed Mar 22 17:01:52 +0000 2017,0.0,0.904,0.096,"Complete Bowser's challenge in #SuperMarioRun, and unlock World 1-4 where you will face Bowser himself! https://t.co/yerp5qneuw",2463
2463,-0.34,Wed Mar 22 16:00:02 +0000 2017,0.107,0.893,0.0,Discover a tale of two armies with one destiny when Fire Emblem Echoes: Shadows of Valentia arrives on May 19 for… https://t.co/QJJDlja9Fg,2464
2464,0.0,Tue Mar 21 19:00:06 +0000 2017,0.0,1.0,0.0,"For one more week, receive 5% off The Legend of #Zelda: Symphony of the Goddesses tickets with code: “LOZ17”… https://t.co/CJnMlF6zWm",2465
2465,0.34,Tue Mar 21 18:00:04 +0000 2017,0.0,0.862,0.138,Watch game experts from Nintendo's Treehouse play against other #Testfire participants on 3/24 @ 12pm PT.… https://t.co/DzXtIz7wJ4,2466
2466,0.7777,Tue Mar 21 17:30:02 +0000 2017,0.0,0.715,0.285,You only have three more days to wait until you can play five awesome Mario sports in #MarioSportsSuperstars! https://t.co/5uUiAAtHac,2467
2467,0.0772,Tue Mar 21 17:00:04 +0000 2017,0.0,0.929,0.071,Mr. Takahashi and Mr. Koizumi challenge you to take your #NintendoSwitch outdoors for a unique way to play… https://t.co/aEP9lMiXjG,2468
2468,0.1511,Tue Mar 21 16:38:43 +0000 2017,0.107,0.759,0.134,Brace yourself! Fire Emblem Echoes for #3DS is launching w/ a Special Edition. Which included item is your favorite… https://t.co/4y8nEWZPcI,2469
2469,0.0,Tue Mar 21 16:00:03 +0000 2017,0.0,1.0,0.0,Do you know the difference between a Toaster and a Slapamander? Discover some of the tools of the trade coming to… https://t.co/mapmKezjh6,2470
2470,0.7644,Tue Mar 21 14:43:05 +0000 2017,0.0,0.743,0.257,"RT @GooglePlay: When it comes to #FEHeroes, Corrin has got to be our fav.

So we made her an @Android exclusive giveaway! 🤗  
https://t.co/…",2471
2471,0.4003,Mon Mar 20 23:37:10 +0000 2017,0.0,0.87,0.13,"On 3/23 you can play as 4 new color variations of Yoshi; Red, Blue, Yellow and Purple in #SuperMarioRun! https://t.co/OCehPCFNxQ",2472
2472,0.3182,Mon Mar 20 20:39:19 +0000 2017,0.0,0.887,0.113,RT @GameStop: Make sure you have the funds you need when our #NintendoSwitch stock replenishes on 3/22 https://t.co/EVDCQJ0Rsp https://t.co…,2473
2473,0.6114,Mon Mar 20 19:00:03 +0000 2017,0.0,0.826,0.174,The Legend of #Zelda: Breath of the Wild has “more perfect scores than any other game in @metacritic history!” https://t.co/umwMCI3vip,2474
2474,0.3182,Mon Mar 20 17:15:06 +0000 2017,0.0,0.887,0.113,Spring into adventure by using #MyNintendo points to score discounts on digital versions of some RPG title favorite… https://t.co/yQEoupwt5p,2475
2475,0.3382,Mon Mar 20 16:00:06 +0000 2017,0.0,0.883,0.117,"Get an in-depth look at some of the characters coming to #ARMS, as well as their unique moves! https://t.co/bmzTNmVOTH",2476
2476,0.0,Sat Mar 18 20:30:04 +0000 2017,0.0,1.0,0.0,It's the #NintendoSwitch Rally finale! Our teams compete in #MK8 Deluxe to find out who's taking home the gold.… https://t.co/iE3RPzXcoG,2477
2477,0.0,Sat Mar 18 00:13:51 +0000 2017,0.0,1.0,0.0,Android version of #SuperMarioRun will be available on 3/23 with the Ver.2.0.0 update! Pre-register now:… https://t.co/GE70IWWqZB,2478
2478,-0.34,Fri Mar 17 23:05:04 +0000 2017,0.173,0.721,0.106,"Discover a labyrinth filled with unimaginable treasure and terrors in The Binding of Isaac, available now on… https://t.co/RBsx1wYoaH",2479
2479,0.0,Fri Mar 17 22:55:51 +0000 2017,0.0,1.0,0.0,RT @Bender_Guitar: #BreathoftheWild #NintendoSwitch https://t.co/HS2ATD2uwJ,2480
