,Compound,Date,Negative,Neutral,Positive,Tweet Text,Tweets Ago
1551,0.5106,Wed Sep 13 22:33:57 +0000 2017,0.0,0.852,0.148,Tencent brings MOBA action to #NintendoSwitch with Arena of Valor. The beta test version will launch for free this… https://t.co/CLWdNpm4P7,1552
1552,-0.2714,Wed Sep 13 22:32:10 +0000 2017,0.116,0.822,0.063,"With over 30 new stages, new challenges, and new worlds, #Snipperclips Plus: Cut it Out, Together! launches Novembe… https://t.co/7F4u4mjnWF",1553
1553,0.1007,Wed Sep 13 22:31:41 +0000 2017,0.115,0.752,0.132,"Lyn joins the fight in #FireEmblemWarriors! The game, the #NintendoSwitch Special Edition, and the Chrom &amp; Tiki ami… https://t.co/ijfVCaC2Ks",1554
1554,0.3382,Wed Sep 13 22:31:15 +0000 2017,0.0,0.888,0.112,"The Kelp Dome map returns to #Splatoon2 this Friday evening! There’s a few new tweaks as well, including some added… https://t.co/i041lQY1uX",1555
1555,0.0,Wed Sep 13 22:29:42 +0000 2017,0.0,1.0,0.0,Your journey through the clouds begins when #XenobladeChronicles2 lands on #NintendoSwitch on December 1st. https://t.co/1tMssY725Z,1556
1556,0.0,Wed Sep 13 22:27:09 +0000 2017,0.0,1.0,0.0,The new Orange and White New Nintendo #2DSXL arrives October 6th. https://t.co/0i6iKbsxWC,1557
1557,0.0,Wed Sep 13 22:26:06 +0000 2017,0.0,1.0,0.0,"3 RPGs from Atlus, #AllianceAlive, #StrangeJourneyRedux, and #RadiantHistoria, all arrive early 2018 on Nintendo… https://t.co/P03bnYMJ1R",1558
1558,0.0,Wed Sep 13 22:25:12 +0000 2017,0.0,1.0,0.0,A new demo for Atlus’ Nintendo #3DS RPG Etrian Odyssey V: Beyond the Myth releases later today in Nintendo eShop.… https://t.co/Mz0MfgA2MZ,1559
1559,0.2023,Wed Sep 13 22:20:59 +0000 2017,0.0,0.909,0.091,"Featuring a curated list of classic minigames, #MarioParty: The Top 100 launches on the Nintendo #3DS family of sys… https://t.co/EzUygiltuw",1560
1560,0.0,Wed Sep 13 22:17:20 +0000 2017,0.0,1.0,0.0,Minecraft: New Nintendo 3DS Edition will be available in Nintendo eShop for the New Nintendo 3DS family of systems… https://t.co/fuKZFQcOxf,1561
1561,-0.4404,Wed Sep 13 22:16:02 +0000 2017,0.163,0.766,0.072,Get fancy with an exclusive outfit in LAYTON’S MYSTERY JOURNEY: Katrielle and the Millionaires’ Conspiracy coming t… https://t.co/4qa3XyaeCb,1562
1562,-0.4926,Wed Sep 13 22:10:38 +0000 2017,0.208,0.792,0.0,Kirby faces off against his toughest rival yet..himself! #Kirby: Battle Royale arrives for the Nintendo #3DS family… https://t.co/33CUb9jAoX,1563
1563,0.0,Wed Sep 13 22:05:04 +0000 2017,0.0,1.0,0.0,Catch the Poké Ball Edition New Nintendo #2DSXL on November 3rd! https://t.co/4rhxTxtmJI,1564
1564,0.0,Wed Sep 13 22:03:56 +0000 2017,0.0,1.0,0.0,Two new Ultra Beasts appear! UB Burst appears in Pokémon Ultra Sun and UB Assembly appears in Pokémon Ultra Moon!… https://t.co/bLdhJmx8g8,1565
1565,0.0,Wed Sep 13 22:02:16 +0000 2017,0.0,1.0,0.0,"Encounter Dusk Mane Necrozma in Pokémon Ultra Sun, and Dawn Wings Necrozma in Pokémon Ultra Moon!… https://t.co/nhcZq8LJRQ",1566
1566,0.0,Wed Sep 13 21:35:04 +0000 2017,0.0,1.0,0.0,Nintendo Direct 9.13.2017 https://t.co/21lMLEqibT,1567
1567,0.3182,Wed Sep 13 01:00:02 +0000 2017,0.0,0.867,0.133,"The Nintendo Switch Online app has been updated to Ver. 1.1. For details, please visit: https://t.co/tEyOcN8o3v",1568
1568,0.8655,Tue Sep 12 23:41:22 +0000 2017,0.0,0.591,0.409,Happy #VideoGamesDay! Between #NintendoSwitch &amp; #3DSXL there’s always something fun to play. Which Nintendo game is… https://t.co/Sunj91ilZN,1569
1569,0.0,Tue Sep 12 23:17:25 +0000 2017,0.0,1.0,0.0,RT @RaymanGame: Rayman Legends Definitive Edition is now available on Nintendo Switch!  #NintendoSwitch #Rayman https://t.co/ih2I0BZ6dM,1570
1570,0.6369,Tue Sep 12 22:56:27 +0000 2017,0.0,0.704,0.296,RT @Polygon: One of the best Metroid games ever made. https://t.co/iZrEUyLqbg,1571
1571,0.5696,Tue Sep 12 21:09:11 +0000 2017,0.0,0.83,0.17,"Reminder: #Pikmin are friends not food! 
Hey! PIKMIN is out now for the Nintendo #3DS family of systems.… https://t.co/NrcxCmE5zI",1572
1572,-0.7351,Tue Sep 12 17:00:05 +0000 2017,0.26,0.691,0.049,The Ice Beam in #Metroid: Samus Returns allows her to temporarily freeze enemies in place. Frozen enemies can even… https://t.co/h8kY2PxXsl,1573
1573,0.0,Tue Sep 12 16:01:43 +0000 2017,0.0,1.0,0.0,Take in the scenery as you ride your Monstie through a vast world filled with incredible places to visit in… https://t.co/f6vbibJTcz,1574
1574,0.0,Mon Sep 11 14:01:55 +0000 2017,0.0,1.0,0.0,Tune in Sept. 13 @ 3pm PT for a new Nintendo Direct featuring upcoming #NintendoSwitch and #3DS titles.… https://t.co/TN41A52ZoV,1575
1575,0.34,Fri Sep 08 20:30:30 +0000 2017,0.0,0.893,0.107,"Which title are you going to play first, Pokémon Gold Version or Pokémon Silver Version? These games release 9/22 o… https://t.co/HotMPIrCOj",1576
1576,0.128,Fri Sep 08 19:59:39 +0000 2017,0.0,0.897,0.103,RT @Walmart: We have a feeling you’re gonna 💗💚 this #Splatoon2 #NintendoSwitch bundle. https://t.co/H6LpmaREZW https://t.co/DEEobPYbsL,1577
1577,0.0,Fri Sep 08 19:30:02 +0000 2017,0.0,1.0,0.0,Get all the info you need to know about #PokkenTournamentDX in this handy vid! Arriving September 22 exclusively fo… https://t.co/2Uj3nirquM,1578
1578,0.5106,Fri Sep 08 19:00:40 +0000 2017,0.074,0.698,0.228,Don’t miss your chance to enter the #MyNintendo Championship Sweepstakes. Entry period ends TODAY at 5pm PT. https://t.co/yhtslZQ36Q,1579
1579,0.34,Fri Sep 08 18:27:48 +0000 2017,0.0,0.888,0.112,"RT @Ubisoft: Watch Stranger Things' @FinnSkata play Rayman Legends Definitive Edition on the Switch this Friday, 12:30PM PT at https://t.co…",1580
1580,-0.2244,Fri Sep 08 17:42:09 +0000 2017,0.109,0.817,0.074,"RT @NintendoVS: Attention, fighting fans! The upcoming #ARMS Ver. 3 update will allow you to remap the controls to the buttons of your choi…",1581
1581,0.5411,Fri Sep 08 17:05:34 +0000 2017,0.0,0.83,0.17,Become a Monster Rider on a quest to save the world in #MonsterHunter Stories! Available now for Nintendo #3DS.… https://t.co/xNdYt5VHCE,1582
1582,0.8516,Fri Sep 08 16:00:10 +0000 2017,0.0,0.672,0.328,Tempest Trials Mini has begun! It's shorter to complete and easier to earn rewards. You can also get rewards you mi… https://t.co/ES5lsG61Y5,1583
1583,0.5033,Thu Sep 07 19:32:09 +0000 2017,0.0,0.847,0.153,"RT @NintendoVS: With over 20 playable Pokémon and even more available as support characters, #PokkenTournamentDX turns up the competition!…",1584
1584,-0.2732,Thu Sep 07 18:00:06 +0000 2017,0.24,0.568,0.192,Form a team of Monsties and execute powerful combo attacks for hours of challenging turn-based battles in… https://t.co/VFkvpMSovd,1585
1585,0.8126,Thu Sep 07 16:33:48 +0000 2017,0.0,0.697,0.303,The Hero with the highest total from this poll combined with @NintendoEurope and @FE_Heroes_JP will win. Poll ends… https://t.co/rqLM9JVXXW,1586
1586,0.9515,Thu Sep 07 16:32:59 +0000 2017,0.0,0.469,0.531,Choose your favorite Starter Support: Bonus Hero! The Hero with the most votes will be sent as a 4★ present! #FEHeroes,1587
1587,0.7351,Thu Sep 07 16:00:03 +0000 2017,0.0,0.725,0.275,"Samus’ Grapple Beam lets her swing from certain objects, giving her access to new areas. It should be a big help in… https://t.co/kwff0OM5Ue",1588
1588,0.0,Thu Sep 07 13:10:12 +0000 2017,0.0,1.0,0.0,"RT @RockstarGames: New Versions of L.A. NOIRE coming Nov 14
For Nintendo Switch, PS4 &amp; Xbox One
Plus THE VR CASE FILES for HTC Vive
https:/…",1589
1589,0.784,Wed Sep 06 21:21:03 +0000 2017,0.0,0.654,0.346,"A noble leader wielding a legendary blade, Chrom is as heroic as it gets! #FireEmblem #NintendoPower https://t.co/jvspvagC6q",1590
1590,0.2023,Wed Sep 06 20:15:21 +0000 2017,0.0,0.921,0.079,"RT @NintendoVS: Due to Hurricane Irma, we have an important update on the #NWC2017 Miami qualifying round. For more info, visit: https://t.…",1591
1591,0.2003,Wed Sep 06 19:49:19 +0000 2017,0.15,0.732,0.118,Be a good captain &amp; leave no #Pikmin behind. Hey! PIKMIN is available now for the Nintendo #3DS family of systems.… https://t.co/DEWjahHyIt,1592
1592,0.7959,Wed Sep 06 17:00:37 +0000 2017,0.0,0.585,0.415,Celebrate the return of Samus with #Metroid themed #MyNintendo rewards! https://t.co/9jsa1SGU9B https://t.co/0ZrU9gaMWz,1593
1593,-0.5255,Wed Sep 06 16:30:08 +0000 2017,0.227,0.672,0.101,"Forge bonds between allies with a new Support system! Battle lvl. 35+ enemies, raise their rank to S, and get battl… https://t.co/5ef87ifsG6",1594
1594,-0.8442,Wed Sep 06 15:49:32 +0000 2017,0.278,0.722,0.0,RT @RE_Games: Bring horror from the dock to the high seas - Resident Evil Revelations 1 and 2 are coming to Nintendo Switch on November 28t…,1595
1595,0.0,Tue Sep 05 21:45:43 +0000 2017,0.0,1.0,0.0,"RT @MLB: After 2 decades, @RBIGAME returns to Nintendo! Get R.B.I. 17 now for #NintendoSwitch. https://t.co/N36wRz7fEo https://t.co/Ymsxuce…",1596
1596,0.0,Tue Sep 05 20:27:03 +0000 2017,0.0,1.0,0.0,RT @LEGOWorldsGame: Make the SWITCH with us! Get physical copy of #LEGOWorlds today on the #NintendoSwitch for $39.99 (Classic Space &amp; Mons…,1597
1597,0.0,Tue Sep 05 18:30:03 +0000 2017,0.0,1.0,0.0,"Planet SR388 is a world of labyrinths, mysterious secrets, and a deadly #Metroid infestation. Samus Aran is the gal… https://t.co/iSbJ0mc8Q6",1598
1598,0.3182,Tue Sep 05 17:23:06 +0000 2017,0.0,0.813,0.187,Stay fresh with these #Splatoon2 accessories for #NintendoSwitch from @horiusainc. https://t.co/8khDMBlbrG,1599
1599,0.7177,Mon Sep 04 17:00:22 +0000 2017,0.0,0.7,0.3,Hope your long weekend has been as sunny as the Mushroom Kingdom’s! 🏖️ https://t.co/MsI17mBJJb,1600
1600,0.8392,Sun Sep 03 17:15:31 +0000 2017,0.0,0.653,0.347,"The #Splatoon2 #Splatfest results are in! Drumroll please…

#TeamFlight wins, 2-1! Congrats!
(This result based on… https://t.co/evRNHScpcy",1601
1601,0.0,Sat Sep 02 21:56:47 +0000 2017,0.0,1.0,0.0,Visit our booth at #PAXWest2017 to go hands-on with upcoming #NintendoSwitch and Nintendo #3DS games! https://t.co/zjSOHPtZBc,1602
1602,-0.7096,Sat Sep 02 18:30:06 +0000 2017,0.237,0.763,0.0,The mother of Metroids is a formidable foe in #Metroid: Samus Returns. Samus will need to think fast to defeat the… https://t.co/uKCELfBhgD,1603
1603,-0.6908,Sat Sep 02 18:00:02 +0000 2017,0.305,0.695,0.0,"Diggernaut, a giant Chozo mining robot, adds new danger and tension throughout #Metroid: Samus Returns. https://t.co/colZKa6cPO",1604
1604,0.8217,Sat Sep 02 15:02:27 +0000 2017,0.082,0.598,0.32,Play Quick Hero Battle now! Earn up to 10 Orbs &amp; 5K Hero Feathers based on the total score by all players!… https://t.co/UzIpUVFZ5p,1605
1605,0.3802,Sat Sep 02 01:22:38 +0000 2017,0.0,0.903,0.097,RT @NintendoVS: Our #PokkenTournamentDX fan event is going on now at the Sheraton Hotel in the Willow Ballroom on the 2nd floor till 8pm! #…,1606
1606,-0.2023,Fri Sep 01 22:14:06 +0000 2017,0.1,0.842,0.058,"You can use it to reach high up places, or even break blocks and objects in #SuperMarioOdyssey. https://t.co/gb9Uncn1Y0",1607
1607,0.0,Fri Sep 01 22:11:49 +0000 2017,0.0,1.0,0.0,Here's a Captured Uproot from #SuperMarioOdyssey! https://t.co/co0KWADPDZ,1608
1608,0.0,Fri Sep 01 21:11:42 +0000 2017,0.0,1.0,0.0,Take the court with you when #NBA2K18 launches on #NintendoSwitch eShop digitally on 9/15 and in retail stores on 1… https://t.co/fLTgyjXZP7,1609
1609,-0.296,Fri Sep 01 20:00:34 +0000 2017,0.115,0.885,0.0,The new Forge Splattershot Pro weapon arrives in #Splatoon2 tonight right before #Splatfest. It features Suction Bo… https://t.co/jufpmbIasq,1610
1610,-0.3802,Fri Sep 01 18:39:32 +0000 2017,0.143,0.792,0.064,"What’s new in #PokkenTournamentDX? Decidueye joins the battle, daily challenges, and lots more! Check the video for… https://t.co/iTbwzRtIm5",1611
1611,0.0,Fri Sep 01 17:30:14 +0000 2017,0.0,1.0,0.0,Manta Maria &amp; a new Shifty Station layout are tonight's #Splatfest maps! It all begins at 9pmPT. Tune in Sunday for… https://t.co/tUUE2Q7F94,1612
1612,-0.4466,Fri Sep 01 16:30:24 +0000 2017,0.196,0.804,0.0,NO PURCH. NEC. 13+; US+CAN (not Quebec) only. Ends 9/8/17 PT. Rules: https://t.co/QiedJHO0k1,1613
1613,0.8398,Fri Sep 01 16:30:08 +0000 2017,0.0,0.64,0.36,Enter the #MyNintendo Championship Sweepstakes by 5pm PT on Sept. 8 for your chance to win a trip to #NWC2017!… https://t.co/JIKJf75I5I,1614
1614,-0.2732,Fri Sep 01 16:00:38 +0000 2017,0.14,0.725,0.135,"Can’t get enough #MarioRabbids? Download the Season Pass and get exclusive weapons, new challenges, co-op maps, and… https://t.co/UZIuLQwSIH",1615
1615,0.0,Fri Sep 01 15:02:22 +0000 2017,0.0,1.0,0.0,Today marks 25 years of #MarioKart in North America! That’s a whole lot of shells and banana peels! https://t.co/YnYdgEJEEK,1616
1616,0.0,Fri Sep 01 05:17:37 +0000 2017,0.0,1.0,0.0,"Three new #amiibo figures in the Shovel Knight series are coming: King Knight, Plague Knight, and Specter Knight! https://t.co/mHfrbI471g",1617
1617,0.0,Fri Sep 01 05:15:05 +0000 2017,0.0,1.0,0.0,Check out even more #Nindies coming to Nintendo Switch in this sizzle reel shown during the #NindiesatNight livestr… https://t.co/r2eUrWIEs2,1618
1618,0.0,Thu Aug 31 20:30:01 +0000 2017,0.0,1.0,0.0,Can’t make #NindiesatNight? We’ll be streaming live with @Hyper_RPG tonight at 9pm PT! #Nindies https://t.co/wyQCrgavc7,1619
1619,0.4003,Thu Aug 31 20:00:38 +0000 2017,0.0,0.87,0.13,"If you’re in the Seattle area, come play games and meet devs tonight @MoPopSeattle at 8:30pm for #NindiesatNight!… https://t.co/0gC2LL0bFz",1620
1620,0.0,Thu Aug 31 19:06:28 +0000 2017,0.0,1.0,0.0,RT @IntiCreatesEN: Azure Striker Gunvolt: Striker Pack is NOW AVAILABLE on the Nintendo Switch eShop! Check out the extended trailer! https…,1621
1621,0.0,Thu Aug 31 18:00:28 +0000 2017,0.0,1.0,0.0,Are you headed to #PAXWest2017 this weekend? Learn how you can skip the lines at Nintendo’s booths with #MyNintendo… https://t.co/29SwHXVqzL,1622
1622,0.0,Thu Aug 31 17:34:43 +0000 2017,0.0,1.0,0.0,Are Pink #Pikmin’s wings just for show? Let’s see! Hey! PIKMIN is available now for the Nintendo #3DS.… https://t.co/MXG2NSrNFF,1623
1623,0.0,Thu Aug 31 16:39:10 +0000 2017,0.0,1.0,0.0,RT @Hyper_RPG: Headed to #PAXWest to film Nindies@Night live for @NintendoAmerica hosted by @PamelaHorton13 &amp; @ShyGuyExpress What do you wa…,1624
1624,-0.5547,Thu Aug 31 16:00:53 +0000 2017,0.23,0.77,0.0,It wouldn’t be a celebration without some cake! Happy 25th anniversary Kirby! #Kirby25 https://t.co/lRZSC4e5iW,1625
1625,0.2714,Thu Aug 31 15:03:04 +0000 2017,0.0,0.913,0.087,"Ike, Lyn, Roy, and Lucina - the Choose Your Legends top 4 - are here, plus new story maps and quests! Earn up to 20… https://t.co/SFD0iRhGaa",1626
1626,0.7269,Thu Aug 31 13:00:08 +0000 2017,0.0,0.747,0.253,"To thank everyone for their participation in the Choose Your Legends event, get a 5★ CYL edition Hero. Choose wisel… https://t.co/Rrc9bnFk1r",1627
1627,0.0,Wed Aug 30 21:25:53 +0000 2017,0.0,1.0,0.0,RT @NintendoAmerica: @ESRBRatings Dabbing is E for everyone! https://t.co/okQvzU9GMr,1628
1628,0.0,Wed Aug 30 21:25:31 +0000 2017,0.0,1.0,0.0,@ESRBRatings Dabbing is E for everyone! https://t.co/okQvzU9GMr,1629
1629,-0.3818,Wed Aug 30 21:00:05 +0000 2017,0.133,0.867,0.0,"Collect, raise, and fight alongside a variety of monsters as you vanquish the Black Blight in #MonsterHunter Storie… https://t.co/l1nRY4cUeD",1630
1630,0.6588,Wed Aug 30 20:30:27 +0000 2017,0.0,0.69,0.31,7th place finishers Ephraim and Cordelia grace the original #FEHeroes wallpaper for September! https://t.co/VVQoyj1NKb,1631
1631,0.3415,Wed Aug 30 19:30:46 +0000 2017,0.107,0.641,0.252,"Chozo Statues have long been important to Samus, providing her with energy, abilities, and more. No wonder they’re… https://t.co/awPpkvaZOl",1632
1632,0.0,Wed Aug 30 18:29:58 +0000 2017,0.0,1.0,0.0,"The next #Splatfest kicks off 9/1 at 9PM PT! Will #TeamFlight soar to victory, or will #TeamInvisibility make Fligh… https://t.co/bgIvFDeXGd",1633
1633,-0.0276,Wed Aug 30 17:24:56 +0000 2017,0.202,0.644,0.154,"Travis Touchdown returns with some indie flavor in Travis Strikes Again: No More Heroes, coming to #NintendoSwitch… https://t.co/TtA32Zlvzl",1634
1634,0.0,Wed Aug 30 17:22:18 +0000 2017,0.0,1.0,0.0,"Team with up to four players and wizard your way to power in Nine Parchments, coming to #NintendoSwitch this holida… https://t.co/R6XlnOJl0e",1635
1635,0.5106,Wed Aug 30 17:21:58 +0000 2017,0.0,0.845,0.155,"The nonstop action continues when Next Up Heroes, Mulaka, and Light Fingers come to #NintendoSwitch in early 2018.… https://t.co/WhTvQbEavX",1636
1636,0.0,Wed Aug 30 17:21:19 +0000 2017,0.0,1.0,0.0,Unleash your inner animal when Yono and the Celestial Elephants and Sausage Sports Club come to #NintendoSwitch thi… https://t.co/vzN1S36Ngq,1637
1637,0.0,Wed Aug 30 17:20:44 +0000 2017,0.0,1.0,0.0,Compete in a unique twist on 4v4 multiplayer when Morphies Law launches on #NintendoSwitch this winter. #Nindies https://t.co/aOmMH84fVb,1638
1638,0.3818,Wed Aug 30 17:19:11 +0000 2017,0.109,0.714,0.176,"Hunt, cook, and compete with the best chefs when Battle Chef Brigade launches first on #NintendoSwitch this holiday… https://t.co/CUoMxNc9yS",1639
1639,0.2244,Wed Aug 30 17:18:33 +0000 2017,0.146,0.637,0.217,Dragon: Marked for Death is an action RPG you can play with up to three friends! Coming exclusively to… https://t.co/PMRQG4102r,1640
1640,0.4199,Wed Aug 30 17:15:43 +0000 2017,0.0,0.859,0.141,Grab your pickaxe and get ready for SteamWorld Dig 2 coming first to #NintendoSwitch on September 21st! #Nindies https://t.co/8Eavp5hkvv,1641
1641,0.0,Wed Aug 30 17:13:57 +0000 2017,0.0,1.0,0.0,Explore the deep sea... or hit the golf tee when Earth Atlantis and Golf Story launch on #NintendoSwitch this fall.… https://t.co/JzxKrNVx5u,1642
1642,0.5106,Wed Aug 30 17:13:15 +0000 2017,0.0,0.837,0.163,Kentucky Route Zero: TV Edition is bringing all 5 acts &amp; interludes of the beloved point-and-click game to… https://t.co/PbAPVT2L4U,1643
1643,-0.1027,Wed Aug 30 17:11:53 +0000 2017,0.065,0.935,0.0,"Train your brain with Mom Hid My Game and Poly Bridge, when they come to #NintendoSwitch later this year. #Nindies https://t.co/9e0L5aqtuE",1644
1644,0.1779,Wed Aug 30 17:11:19 +0000 2017,0.159,0.647,0.194,Bring beautiful vengeance upon your enemies in upcoming beat-em-up Wulverblade – launching first on #NintendoSwitch… https://t.co/Mf2duQZ1N1,1645
1645,0.5294,Wed Aug 30 17:10:32 +0000 2017,0.0,0.848,0.152,"Feel the rhythm, feel the rhyme – get on up, it’s Floor Kids time! Coming to #NintendoSwitch this holiday. #Nindies https://t.co/nloDBvcMCq",1646
1646,0.296,Wed Aug 30 17:07:33 +0000 2017,0.0,0.901,0.099,"Shovel Knight: King of Cards is the final campaign in the Treasure Trove saga, and it’s coming to #NintendoSwitch i… https://t.co/qkO9ICjPZL",1647
1647,0.0,Wed Aug 30 17:02:41 +0000 2017,0.0,1.0,0.0,"Team Meat is bringing their beefy sequel, @SuperMeatBoy Forever to #NintendoSwitch next year! #Nindies https://t.co/SrGpBTp6AX",1648
1648,0.0,Wed Aug 30 17:02:33 +0000 2017,0.0,1.0,0.0,https://t.co/4yz4Qk13uH,1649
1649,0.3595,Wed Aug 30 17:00:24 +0000 2017,0.0,0.783,0.217,Join us right now for a look at upcoming #Nindies! https://t.co/qcN9TpZwnp,1650
1650,-0.4466,Wed Aug 30 16:00:26 +0000 2017,0.134,0.866,0.0,"NO PURCH NEC. Open to residents of US &amp; CAN (excl. QC), 13+. Deadline: 9/6/17. See rules @ https://t.co/FLpQSrnKbT. Sponsor: Nintendo.",1651
1651,0.6476,Wed Aug 30 16:00:09 +0000 2017,0.082,0.64,0.278,Don’t go back to school empty handed. RT for a chance to win a New Nintendo #2DSXL! #NintendoSweepstakes… https://t.co/SbezHlGA3P,1652
1652,0.8016,Wed Aug 30 15:00:04 +0000 2017,0.0,0.725,0.275,Which 5★ Choose Your Legends Hero will you pick? Tweet your choice below to see a rough illustration of the Heroes! https://t.co/I0y9eSaOiE,1653
1653,0.0,Wed Aug 30 04:27:52 +0000 2017,0.0,1.0,0.0,RT @gamespot: https://t.co/LMtyrjIsoC,1654
1654,0.0,Tue Aug 29 22:42:36 +0000 2017,0.0,1.0,0.0,RT @JamesPopStar: TODAY IS THE DAY! Shantae: Pirate Queen's Quest has arrived! Download it on your platform of choice and have a lot of fun…,1655
1655,0.0,Tue Aug 29 22:00:18 +0000 2017,0.0,1.0,0.0,Kirby’s Blaster Bullet is mighty! Check out Kirby’s Blowout Blast on the Nintendo #3DS family of systems. #Kirby25… https://t.co/DukYTNedJu,1656
1656,0.2401,Tue Aug 29 18:20:12 +0000 2017,0.0,0.911,0.089,RT @rabbidsofficial: Don't forget the #MarioRabbids developer launch stream with live Q&amp;A. Send us your questions! Watch live on twitch - h…,1657
1657,-0.4389,Tue Aug 29 17:49:06 +0000 2017,0.194,0.806,0.0,"Mario + Rabbids Kingdom Battle is available now on #NintendoSwitch! 
Learn more: https://t.co/u9Cj1buZyP… https://t.co/GcYJvabSGw",1658
1658,0.8074,Tue Aug 29 17:01:13 +0000 2017,0.0,0.759,0.241,Pick a 5★ Choose Your Legends Hero at 12am PT 8/31 and RT this tweet until 7:59pm on 9/3 for a reward of up to 5 Or… https://t.co/aQrei1jFLR,1659
1659,0.0,Tue Aug 29 16:01:14 +0000 2017,0.0,1.0,0.0,"#Splatoon2 servers will undergo maintenance today, from 6-11PM PT. During this time, online services will be unavailable.",1660
1660,0.0,Tue Aug 29 00:04:09 +0000 2017,0.0,1.0,0.0,https://t.co/z3sXsXKFKt,1661
1661,0.0,Mon Aug 28 22:46:02 +0000 2017,0.0,1.0,0.0,Are #Pikmin harder than crystal? Let’s see. Hey! PIKMIN is available now for the Nintendo #3DS family of systems.… https://t.co/DKptV9J6cK,1662
1662,0.0,Mon Aug 28 21:50:20 +0000 2017,0.0,1.0,0.0,"The #PokemonUltraSunMoon Veteran Trainer’s Dual Pack will be available Nov. 17th. It includes both games, 16 art ca… https://t.co/uhbhVustX8",1663
1663,0.4574,Mon Aug 28 21:44:55 +0000 2017,0.0,0.834,0.166,"#FireEmblemWarriors Special Edition includes 3 CDs, a dual-sided poster &amp; 25 character art cards! Available Oct. 20… https://t.co/zQghhXRN5V",1664
1664,0.3816,Mon Aug 28 21:01:38 +0000 2017,0.0,0.794,0.206,Make back to school a little brighter with #NintendoSwitch and #Splatoon2! https://t.co/3Pv8Pjlliu,1665
1665,0.0,Mon Aug 28 17:01:17 +0000 2017,0.0,1.0,0.0,Catch a new Nindies Showcase video presentation on 8/30 at 10am PT highlighting multiple indie games coming to… https://t.co/Q2fHMsIWS8,1666
1666,0.6705,Mon Aug 28 16:30:17 +0000 2017,0.0,0.776,0.224,"A new Voting Gauntlet begins at 12am PT on 8/31. To celebrate, 2 Summoning Events for the Choose Your Legends Top 8… https://t.co/9qI3hApDeu",1667
1667,0.0,Mon Aug 28 16:00:04 +0000 2017,0.0,1.0,0.0,"Samus can wall jump for extra elevation. New to #Metroid: Samus Returns, she can hang from ledges and pull herself… https://t.co/89rWOaazxa",1668
1668,0.7964,Mon Aug 28 14:07:07 +0000 2017,0.0,0.616,0.384,"Download and enjoy these special #SNESClassic-themed #NintendoPower covers, and join our #PAXWest2017 panel to rece… https://t.co/GNzP97w49g",1669
1669,-0.296,Mon Aug 28 03:44:26 +0000 2017,0.104,0.896,0.0,"Feh is taking a well-deserved nap after Feh Channel - Choose Your Legends. If you missed it, check it out here:… https://t.co/A0AwQLxihP",1670
1670,0.4471,Mon Aug 28 03:03:22 +0000 2017,0.0,0.828,0.172,Feh Channel - Choose Your Legends starts at 8:30pm PT. Feh has lots of info to share. Don't miss it! #FEHeroes… https://t.co/TZgnJ7OWlD,1671
1671,0.7644,Sat Aug 26 19:49:17 +0000 2017,0.0,0.708,0.292,RT @BBYNews: Calling @NintendoAmerica lovers: the Championship qualifiers are happening today &amp; tomorrow at @BestBuy stores only! https://t…,1672
1672,0.8718,Sat Aug 26 15:03:28 +0000 2017,0.0,0.447,0.553,"#Yoshi, Poochy, and their fluffy friend wish everyone a happy #NationalDogDay! https://t.co/AyuXfKIfKY",1673
1673,0.6908,Fri Aug 25 22:12:43 +0000 2017,0.0,0.695,0.305,"RT @primagames: Introducing: Playing w/ Super Power #Nintendo #SNES Classics Collector's Edition Guide https://t.co/S6Y4qXypsK
@NintendoAme…",1674
1674,-0.4404,Fri Aug 25 19:50:09 +0000 2017,0.127,0.873,0.0,"Unlike Mario, it doesn’t have to worry about coming up for air, so you can explore underwater at your leisure.… https://t.co/BA6hK6UhRn",1675
1675,0.4404,Fri Aug 25 19:45:19 +0000 2017,0.0,0.818,0.182,This is a Captured Cheep Cheep. It can move freely in the water. #SuperMarioOdyssey https://t.co/MBRN3aUOnQ,1676
1676,-0.8016,Fri Aug 25 18:12:29 +0000 2017,0.353,0.647,0.0,"Wash away that pesky enemy ink with the Sloshing Machine weapon, coming to #Splatoon2 tonight at 7PM! https://t.co/BFAmEsnaMb",1677
1677,0.7269,Fri Aug 25 17:42:25 +0000 2017,0.0,0.766,0.234,Every hero needs a meal after a long day of questing in #Miitopia. Find the kinds of food your Miis like and they’l… https://t.co/N5tSxyyDID,1678
1678,-0.3182,Fri Aug 25 15:01:26 +0000 2017,0.103,0.897,0.0,Fought in the previous ARMS Global Testpunch? You can redownload the software by visiting your Account Information page in Nintendo eShop.,1679
1679,0.5562,Fri Aug 25 15:00:53 +0000 2017,0.0,0.841,0.159,The #ARMS Global Testpunch starts now! Download the free demo from Nintendo eShop on #NintendoSwitch and put your A… https://t.co/fAf70pF8YZ,1680
1680,0.0,Fri Aug 25 07:00:06 +0000 2017,0.0,1.0,0.0,Feh Channel - Choose Your Legends starts at 8:30pm PT on 8/27! #FEHeroes https://t.co/AIGvdnd971 https://t.co/XuolEgXSLT,1681
1681,0.0,Thu Aug 24 22:39:25 +0000 2017,0.0,1.0,0.0,You’ve come a long way Kirby! Take a look at the pink hero’s history in this #Kirby25 video. #TBT https://t.co/AHdIbuk9FL,1682
1682,0.4199,Thu Aug 24 21:19:49 +0000 2017,0.0,0.798,0.202,It looks like Princess Peach has been busy for #NationalPeachPieDay! 🍑 https://t.co/PcnvYSnVbk,1683
1683,0.6344,Thu Aug 24 15:45:57 +0000 2017,0.0,0.755,0.245,Get ready to defend the galaxy or become the Dark Knight when more @telltalegames adventures arrive on… https://t.co/5wQdYwzV8H,1684
1684,0.0431,Thu Aug 24 15:01:05 +0000 2017,0.105,0.785,0.111,"NO PURCH NEC. US &amp; CAN residents (excl. Quebec), 13+. 6 winners ARV $0. See Rules 4 details. Enter by 5pm PT on 8/30/17. Sponsor: Nintendo.",1685
