,Compound,Date,Negative,Neutral,Positive,Tweet Text,Tweets Ago
774,0.4738,Sun Feb 11 14:16:10 +0000 2018,0.0,0.866,0.134,RT @NintendoVS: Get ready to dunk on your opponents when Goby Arena enters the map rotation in #Splatoon2! Coming soon! https://t.co/s3lfif…,775
775,-0.1759,Sun Feb 11 14:00:01 +0000 2018,0.131,0.764,0.105,"Good news for #Splatoon2 fans, Pearl and Marina #amiibo are on the way! The Off the Hook 2-pack steals the show lat… https://t.co/mt9AMTCzyo",776
776,0.296,Sat Feb 10 04:30:02 +0000 2018,0.0,0.909,0.091,Join Adol and his companions as they unravel the riddle of the mysterious isle of Seiren in Ys VIII: Lacrimosa of D… https://t.co/vt1bMZSiLr,777
777,-0.0772,Sat Feb 10 04:15:04 +0000 2018,0.115,0.783,0.101,Join Dusk Witch Dronya and her brigade of puppet soldiers as they explore a miasma-filled labyrinth in Labyrinth of… https://t.co/nAVhgnwMfh,778
778,-0.3182,Sat Feb 10 04:00:05 +0000 2018,0.119,0.881,0.0,"From classic costumes to brand-new styles, you can customize your #SNKHEROINES: Tag Team Frenzy experience with 3 d… https://t.co/HGz5ZoPFBM",779
779,0.4199,Sat Feb 10 03:05:22 +0000 2018,0.0,0.883,0.117,"RT @NintendoVS: The #Splatoon2 #Splatfest is back, and this time it’s #TeamMoney versus #TeamLove! Pick a side and get ready to splat when…",780
780,0.0,Fri Feb 09 22:01:50 +0000 2018,0.0,1.0,0.0,RT @rocketjumptweet: New video! Skyrim's back! #SkyrimSwitch https://t.co/AVl9c02Zij,781
781,0.0,Fri Feb 09 21:06:36 +0000 2018,0.0,1.0,0.0,Say hello to Francisca! She’s a new character making her debut in #KirbyStarAllies. She uses the power of ice to at… https://t.co/nN47dIV7rL,782
782,-0.4389,Fri Feb 09 18:10:28 +0000 2018,0.121,0.879,0.0,Discover tips on how to tap your way to victory in the new Tap Battle: Illusory Dungeon with this video! #FEHeroes https://t.co/wnT75XPBjc,783
783,-0.7263,Fri Feb 09 18:01:02 +0000 2018,0.253,0.747,0.0,"The brand-new event, Tap Battle: Illusory Dungeon, has begun! Tap with accurate timing to take down enemies with 4… https://t.co/enXmgmJe23",784
784,0.4199,Fri Feb 09 17:38:08 +0000 2018,0.0,0.851,0.149,Learn all about the Version 1.3.0 update coming to #XenobladeChronicles2 courtesy of Director Tetsuya Takahashi! Th… https://t.co/CB45PmtogW,785
785,0.2023,Fri Feb 09 17:00:02 +0000 2018,0.124,0.68,0.196,"Gather, craft, and build the kingdom of your dreams to restore the ruined world of Alefgard in @DragonQuest Builder… https://t.co/cObF1Qt5hY",786
786,0.9516,Fri Feb 09 15:00:06 +0000 2018,0.0,0.452,0.548,Special Heroes in lovely outfits are part of a 5★ Summoning Focus! They're celebrating a festival where you give pr… https://t.co/dfF7RWdQGI,787
787,0.3802,Thu Feb 08 22:30:46 +0000 2018,0.111,0.664,0.225,Make sure you’re ready for the Witch when #Bayonetta 1 &amp; 2 arrive 2/16 on #NintendoSwitch! Digital pre-purchase is… https://t.co/aMwxmBjYNU,788
788,0.501,Thu Feb 08 21:00:21 +0000 2018,0.0,0.854,0.146,"It’s been a long time since Kirby last swept up, but the Cleaning Copy Ability returns in #KirbyStarAllies! Not onl… https://t.co/dzhBKG6WWf",789
789,0.2363,Thu Feb 08 20:00:09 +0000 2018,0.178,0.543,0.278,"Who else loves Dracky?! With cute shoe-button eyes and sharp fangs, this evil being has a delicate balance of adora… https://t.co/mCzus09fkc",790
790,-0.3818,Thu Feb 08 19:00:05 +0000 2018,0.167,0.833,0.0,Charge into battle with Hyrule’s mightiest legends when #HyruleWarriors: Definitive Edition arrives on… https://t.co/RETFxnqzBx,791
791,0.0,Thu Feb 08 18:01:38 +0000 2018,0.0,1.0,0.0,"Think you've seen it all? With Ultimate NES Remix for Nintendo #3DS, you could find yourself being chased by Boo ch… https://t.co/FnUavER2gK",792
792,0.8883,Thu Feb 08 17:02:46 +0000 2018,0.0,0.644,0.356,The midway results for the #FEHeroes A Hero Rises event are in! You can vote for your favorite Hero once a day. The… https://t.co/pis0PBxG8L,793
793,0.0,Thu Feb 08 15:01:42 +0000 2018,0.0,1.0,0.0,A #MyNintendo update in early March will let you redeem Gold Points for select digital games and DLC for… https://t.co/9ASNt3cllg,794
794,0.0,Thu Feb 08 14:01:20 +0000 2018,0.0,1.0,0.0,The Shadow Dragon DLC pack for #FireEmblemWarriors comes to #NintendoSwitch 2/14! This pack includes 3 new characte… https://t.co/RvO7E6kFxJ,795
795,0.0,Wed Feb 07 22:13:37 +0000 2018,0.0,1.0,0.0,"RT @DPadStudio: Owlboy is flying to the Switch February 13th, with physicals hitting stores May 29th!  https://t.co/AITp39pEz8 @SOEDESCO @B…",796
796,0.784,Wed Feb 07 20:18:35 +0000 2018,0.0,0.744,0.256,Love is in the air on Play Nintendo! Find out which Nintendo character would be your Valentine’s Day match with thi… https://t.co/lnXcl4ciZI,797
797,0.3382,Wed Feb 07 18:00:55 +0000 2018,0.0,0.877,0.123,"Here's the first concept art for Tostarena! Even then, certain gameplay elements were already incorporated and a su… https://t.co/nDqIQFw6wX",798
798,0.0,Tue Feb 06 21:30:05 +0000 2018,0.0,1.0,0.0,RT @Xeodrifter: Drifting through the stars. Xeodrifter lands on #NintendoSwitch February 15 in North America and Europe for $9.99 / €9.99 /…,799
799,0.2263,Tue Feb 06 20:24:07 +0000 2018,0.0,0.894,0.106,"Experience a unique 2D platformer full of mystical creatures and boundless exploration in #Dandara, available now i… https://t.co/LAm4fKocNM",800
800,0.0,Tue Feb 06 19:00:54 +0000 2018,0.0,1.0,0.0,Use motion-controlled steering to control and race your Toy-Con Motorbike! Available exclusively as part of the… https://t.co/sYAeCK3Sqv,801
801,0.0772,Tue Feb 06 18:00:58 +0000 2018,0.0,0.942,0.058,"Did you know Slime is a monster that appears in every game? As a beginning challenge, they often stand in the way o… https://t.co/s6vQ44V8ml",802
802,0.658,Mon Feb 05 21:31:44 +0000 2018,0.0,0.788,0.212,Whoa! It looks like King Dedede has been hitting the gym! Or is something else responsible for his big build? Eithe… https://t.co/HTHZxJDdQl,803
803,0.0,Mon Feb 05 18:56:20 +0000 2018,0.102,0.795,0.102,RT @NintendoVS: The next #ARMS Party Crash will feature Springtron and Kid Cobra! Going on from 2/9 1am PT – 2/12 1am PT. https://t.co/TgpC…,804
804,0.5994,Mon Feb 05 18:00:04 +0000 2018,0.0,0.837,0.163,"Super Mario 3D Land, The Legend of Zelda: A Link Between Worlds, and Ultimate NES Remix for Nintendo #3DS are avail… https://t.co/bevTjyZn0o",805
805,0.0,Mon Feb 05 17:00:05 +0000 2018,0.0,1.0,0.0,"We sit down with Mr. Koizumi, the producer of #SuperMarioOdyssey, and ask him some of those questions we have all w… https://t.co/mSdExpEfEo",806
806,0.2732,Sun Feb 04 18:01:19 +0000 2018,0.0,0.909,0.091,See how well Kit and Krysta know each other as they pick out a #NintendoSwitch game they think the other would like… https://t.co/1IDxYEjncf,807
807,0.6351,Sat Feb 03 18:02:07 +0000 2018,0.0,0.782,0.218,The #FEHeroes calendar wallpaper for February is here! It features Legendary Hero Ike: Vanguard Legend! https://t.co/szo9iHqW14,808
808,0.2905,Fri Feb 02 19:00:05 +0000 2018,0.0,0.786,0.214,Wahahaha! It’s Waaaa-luigi time! Waluigi number one! #NintendoPower https://t.co/XvNFwaW06H,809
809,0.0,Fri Feb 02 18:30:02 +0000 2018,0.0,1.0,0.0,RT @DPadStudio: Owlboy is now available for Pre-Order in the Nintendo eShop! Head on over to your Switch and pre-order it now! https://t.co…,810
810,0.6696,Fri Feb 02 18:00:20 +0000 2018,0.094,0.65,0.256,Let the battles begin! Kirby is back with pink ‘n’ puffy #MyNintendo rewards to celebrate the release of #Kirby Bat… https://t.co/faO4NeT7Zh,811
811,0.906,Fri Feb 02 17:16:53 +0000 2018,0.0,0.639,0.361,Right on the tails of the Choose Your Legends event comes A Hero Rises! Which Hero will be crowned #1? The winner w… https://t.co/EfRCMsqywm,812
812,0.4926,Fri Feb 02 16:11:45 +0000 2018,0.0,0.842,0.158,"Going on now - It's a 5-part #FEHeroes Anniversary Celebration!

① 1st Anniv. Present: one-time gift of 50 Orbs
② 1… https://t.co/BA8Pcw7j9F",813
813,-0.1511,Fri Feb 02 03:05:13 +0000 2018,0.115,0.794,0.091,The Sleep Copy Ability is now available for #Kirby Battle Royale! Can Kirby and his night cap put the competition t… https://t.co/x2wBIRzxyC,814
814,0.2837,Fri Feb 02 00:41:49 +0000 2018,0.094,0.771,0.136,RT @AtlusUSA: Can't wait for Radiant Historia: Perfect Chronology later this month? You can download the demo right now in the Nintendo eSh…,815
815,0.7506,Thu Feb 01 22:34:04 +0000 2018,0.0,0.738,0.262,"RT @Official_AIAS: We're pleased to announce that the seventh recipient of the AIAS Lifetime Achievement Award is @Nintendo's Genyo Takeda,…",816
816,0.7579,Thu Feb 01 21:30:21 +0000 2018,0.071,0.647,0.282,"RT @ImageForm: Dear friends, the day has come: Rusty has finally dug his way up to #NintendoSwitch. Welcome back, we've missed you very muc…",817
817,0.2942,Thu Feb 01 21:00:38 +0000 2018,0.083,0.785,0.132,A mysterious force has struck Planet Popstar! It’s up to Kirby and the power of friendship to defend the planet in… https://t.co/TePzhq50zX,818
818,0.0,Thu Feb 01 20:00:45 +0000 2018,0.0,1.0,0.0,"RT @NightInTheWoods: Night In The Woods is now available on the Nintendo Switch.
https://t.co/6nKcK4LCtB https://t.co/O2aIUZ8REc",819
819,0.5848,Thu Feb 01 18:00:37 +0000 2018,0.0,0.79,0.21,Here are the top place finishers in the #FEHeroes Choose Your Legends: Round 2 event! A special CYL version of thes… https://t.co/7GgRxlnLip,820
820,0.0,Thu Feb 01 17:30:04 +0000 2018,0.0,1.0,0.0,"RT @NintendoVS: The #ARMS Ver. 5.1 update is now available to download!

・New Tournament Mode
・New Gallery feature
・New additions to Party…",821
821,0.5093,Thu Feb 01 15:00:02 +0000 2018,0.102,0.667,0.231,Can Kirby fight while he’s sleeping?! Find out when the Sleep Copy Ability arrives in a free software update for… https://t.co/d1DqwaX9pX,822
822,0.0,Thu Feb 01 01:44:16 +0000 2018,0.0,1.0,0.0,"Nintendo and Illumination are partnering on a movie starring Mario, co-produced by Shigeru Miyamoto and Chris Meled… https://t.co/9cRl7PaVyC",823
823,0.0,Thu Feb 01 01:36:16 +0000 2018,0.0,1.0,0.0,The checkered flag has been raised and the finish line is near. A new mobile application is now in development: Mar… https://t.co/3MzXbCdqIh,824
824,0.0,Thu Feb 01 01:21:37 +0000 2018,0.0,1.0,0.0,#NintendoSwitch Online will launch in September 2018! https://t.co/h3Rpeyymsx,825
825,0.1739,Thu Feb 01 00:36:44 +0000 2018,0.119,0.731,0.15,"New Battle Pokémon, Support Pokémon, and avatar items are here! Wave 1 including Aegislash is available now! Purcha… https://t.co/nDFShlZPAo",826
826,0.5242,Wed Jan 31 21:31:41 +0000 2018,0.0,0.842,0.158,It’s Timmy and Tommy Nook from #AnimalCrossing! Nice work from all the Villagers out there who guessed correctly! https://t.co/Vm10G8aTeK,827
827,0.0,Wed Jan 31 20:00:04 +0000 2018,0.0,1.0,0.0,"RT @NecroDancerGame: Crypt of the NecroDancer launches on the Nintendo Switch February 1st in the Americas&amp;Japan, and February 8th in Europ…",828
828,0.0,Wed Jan 31 19:01:31 +0000 2018,0.0,1.0,0.0,It’s an #amiibo mystery! Can you tell who this is? Let us know in the replies and we’ll reveal the answer later tod… https://t.co/b2smdCsG1W,829
829,0.5983,Wed Jan 31 18:30:30 +0000 2018,0.061,0.728,0.21,Don’t miss your chance to save up to 30% on select digital titles for #NintendoSwitch in Nintendo eShop! The sale e… https://t.co/XYjCYNcJ5c,830
830,0.296,Wed Jan 31 18:00:05 +0000 2018,0.0,0.901,0.099,Watch Mr. Aonuma and Mr. Fujibayashi talk about The Legend of #Zelda: Breath of the Wild and share some behind-the-… https://t.co/DsuzJqiSLL,831
831,0.0,Wed Jan 31 16:45:05 +0000 2018,0.0,1.0,0.0,"RT @CIRCLE_Ent: Mercenaries Saga Chronicles (a trilogy of tactical RPGs!) arrives on #NintendoSwitch eShop on 8th February, but you can pre…",832
832,0.5983,Wed Jan 31 15:00:04 +0000 2018,0.0,0.83,0.17,"A summoning event with Legendary Hero Ike: Vanguard Legend has begun! If you summon him, you'll also receive the it… https://t.co/gXZZPKlvPp",833
833,0.9117,Wed Jan 31 03:46:56 +0000 2018,0.0,0.574,0.426,"Feh is enjoying her birthday dreams! We hope you enjoyed the latest edition of #FEHeroes Feh Channel.

If you misse… https://t.co/G74QS3EeqV",834
834,0.6636,Wed Jan 31 03:01:53 +0000 2018,0.0,0.737,0.263,Feh is getting ready to share the latest information on #FEHeroes! Don't miss her chill stream starting at 7:30pm P… https://t.co/Rid1t7CULs,835
835,0.7639,Wed Jan 31 02:05:05 +0000 2018,0.09,0.591,0.319,"Get your pajamas ready, because we have a winner! The Sleep Copy Ability will be coming to #Kirby Battle Royale! Th… https://t.co/SYKOGw69id",836
836,-0.34,Tue Jan 30 21:35:24 +0000 2018,0.167,0.726,0.107,"Classic skins from franchises like Gears of War, Halo, and Banjo-Kazooie will also be available today for Minecraft… https://t.co/DA7MIoLYlw",837
837,0.0,Tue Jan 30 21:30:08 +0000 2018,0.0,1.0,0.0,"Set sail with Moana, Maui, and the whole crew from Motunui with the Moana Character Pack! Available today for Minec… https://t.co/z4FwZvFAyH",838
838,0.69,Tue Jan 30 18:30:06 +0000 2018,0.118,0.554,0.328,Turn your enemies into friends with Kirby’s new Friend Heart ability in #KirbyStarAllies! Journey with up to 3 frie… https://t.co/i9CB8yyBFh,839
839,0.2023,Tue Jan 30 18:00:38 +0000 2018,0.0,0.921,0.079,"The Odyssey is a mix between a top hat and a boat, and uses Cappy’s white and Mario’s red as the main colors. There… https://t.co/ONvbfeYDoZ",840
840,0.0,Tue Jan 30 17:01:24 +0000 2018,0.0,1.0,0.0,"Unleash your inner composer with the Toy-Con Piano! Available exclusively in the #NintendoLabo Variety Kit, arrivin… https://t.co/x8kOLsX8j2",841
841,0.4199,Tue Jan 30 16:00:01 +0000 2018,0.0,0.872,0.128,Thank you to everyone who provided their feedback on the project OCTOPATH TRAVELER demo! The development team has b… https://t.co/51uwivxGbG,842
842,0.0,Tue Jan 30 03:00:04 +0000 2018,0.0,1.0,0.0,"A super-relaxing edition of Feh Channel is coming 1/30 at 7:30pm PT! It'll be about 15 mins. long. #FEHeroes

For m… https://t.co/F8CcC2UNzr",843
843,0.0,Mon Jan 29 20:01:00 +0000 2018,0.0,1.0,0.0,Redeem your #MyNintendo Gold Points for some of the hottest #Nindies on Nintendo #3DS and Wii U!… https://t.co/1YZzL7y8rb,844
844,0.1007,Mon Jan 29 19:00:27 +0000 2018,0.0,0.924,0.076,Stretch your limits and reach for victory with #ARMS! Currently 30% off during the #NintendoSwitch eShop Sale.… https://t.co/kNFz6phm7i,845
845,0.34,Mon Jan 29 18:02:14 +0000 2018,0.0,0.888,0.112,"In Ultimate NES Remix for Nintendo #3DS, play through a mash-up of classic NES games where you could find yourself… https://t.co/89bqJLtPmq",846
846,-0.4466,Sun Jan 28 18:01:11 +0000 2018,0.128,0.872,0.0,NO PURCH NECESSARY. U.S. &amp; Canada (excl. Quebec) residents only. Must be 13 or older. Enter by 3pm 2/2/18. See… https://t.co/Pzu0TeXRdN,847
847,0.0,Sun Jan 28 18:00:04 +0000 2018,0.0,1.0,0.0,"Watch the latest episode of #NintendoMinute for a look at Splatoon, Vol. 1 from @VIZMedia and learn how to enter fo… https://t.co/ltQfEOUsht",848
848,0.5106,Sat Jan 27 00:00:08 +0000 2018,0.0,0.82,0.18,"The version 1.3.0 free update for #XenobladeChronicles2 arrives mid-February, and will introduce a new second playt… https://t.co/g9g2KvoFJR",849
849,-0.1779,Fri Jan 26 20:00:37 +0000 2018,0.091,0.909,0.0,Have you started thinking about where you’ll hide all those balloons in Luigi's Balloon World mini-game for… https://t.co/rUDk78ZkXm,850
850,0.0,Fri Jan 26 18:00:15 +0000 2018,0.0,1.0,0.0,RT @Official_GDC: Splatoon 2 and Arms devs will be speaking at GDC 2018! - https://t.co/ZiP33SneVk,851
851,0.0,Fri Jan 26 17:30:09 +0000 2018,0.0,1.0,0.0,It’s time to return to the Johto region! #PokemonCrystal is now available for the Nintendo #3DS family of systems!… https://t.co/udZgYoT5oV,852
852,0.6908,Fri Jan 26 17:02:28 +0000 2018,0.0,0.737,0.263,"Get ready for the #DetectivePikachu launch on 3/23 with the adorable New Nintendo #2DSXL Pikachu Edition, available… https://t.co/NblVr2U1eA",853
853,0.4003,Thu Jan 25 23:56:35 +0000 2018,0.0,0.87,0.13,#PokemonCrystal arrives this Friday on the Nintendo #3DS family of systems! Are you excited to encounter Celebi aga… https://t.co/IeyaeigmhE,854
854,0.0,Thu Jan 25 23:07:49 +0000 2018,0.0,1.0,0.0,"Episode 2 of #NintendoPower Podcast is now available, with a #NintendoLabo roundtable, Pros' Picks, your listener q… https://t.co/1z4C6kk5cd",855
855,0.0,Thu Jan 25 21:31:02 +0000 2018,0.0,1.0,0.0,"Check out this month’s highlighted #NintendoSwitch and Nintendo #3DS games that you can find in Nintendo #eShop!

V… https://t.co/QZUzXTgel5",856
856,-0.2481,Thu Jan 25 20:12:32 +0000 2018,0.193,0.658,0.149,It's time to brave the brutal climb in #Celeste – available now in Nintendo #eShop on #NintendoSwitch!… https://t.co/x9rPnP5G6T,857
857,0.5106,Thu Jan 25 19:00:56 +0000 2018,0.0,0.852,0.148,RT @AppStore: There's cuteness stuffed into every corner of @NintendoAmerica's Animal Crossing: Pocket Camp. Here's a handful of tips to se…,858
858,0.0,Thu Jan 25 18:30:03 +0000 2018,0.0,1.0,0.0,"RT @Natsume_Inc: Saddle up partners, we’re riding onto a new console!  The arcade shooter Wild Guns RELOADED is heading to Nintendo Switch…",859
859,0.4215,Thu Jan 25 18:00:03 +0000 2018,0.0,0.826,0.174,"RT @IGN: .@AegisDefenders​, the local co-op tower defense adventure, is hitting the #NintendoSwitch​ and other platforms on Feb. 8. #AegisD…",860
860,0.0,Thu Jan 25 17:30:04 +0000 2018,0.0,1.0,0.0,Need some new digital games for your #NintendoSwitch system? Select digital titles are up to 30% off in Nintendo eS… https://t.co/NUkSq9kYZJ,861
861,0.7424,Thu Jan 25 15:00:02 +0000 2018,0.089,0.627,0.284,"Three 5★ Heroes from Fire Emblem: The Sacred Stones are here! You can get Myrrh: Great Dragon, L'Arachel: Princess… https://t.co/IMc4DHBXI7",862
862,0.5106,Wed Jan 24 22:30:30 +0000 2018,0.0,0.87,0.13,RT @GameStop: All you need to take down a dragon is a little slime. Pre-order Dragon Quest Builders today and receive free in-game items ht…,863
863,0.5983,Wed Jan 24 22:00:06 +0000 2018,0.066,0.747,0.186,"Don’t miss out on some of the best games! #SuperMarioOdyssey, The Legend of #Zelda: Breath of the Wild, #MarioKart… https://t.co/Kw2R3OiJIJ",864
864,0.8687,Wed Jan 24 21:00:24 +0000 2018,0.0,0.66,0.34,"The free short version of “Jump Up, Super Star!” will be available until 1/31. Make sure to download it before then… https://t.co/YhBff3ehGP",865
865,-0.9059,Wed Jan 24 19:01:01 +0000 2018,0.419,0.581,0.0,"Collect coins and avoid getting possessed in Coin Clash! You’ll start to lose coins if you’re haunted, so attack an… https://t.co/8TrCsqaYqT",866
866,0.5994,Wed Jan 24 18:01:16 +0000 2018,0.0,0.83,0.17,"Run, jump, and power-up with Mario through multiple colorful worlds in Super Mario 3D Land for Nintendo #3DS. Comin… https://t.co/Eus9Z69wKc",867
867,-0.3182,Tue Jan 23 20:30:03 +0000 2018,0.108,0.892,0.0,"Embark on a desperate journey to survive as you are forever pursued by a monstrous and unrelenting storm in Shu, av… https://t.co/ZS3Qa086KY",868
868,-0.3885,Tue Jan 23 19:30:03 +0000 2018,0.273,0.544,0.183,Face an ominous power that threatens the fabric of reality and restore memories to save a fading world in LOST SPHE… https://t.co/fQdAtF3gMq,869
869,0.6908,Tue Jan 23 17:30:08 +0000 2018,0.0,0.778,0.222,"Here’s a look at the final design sketch for Cappy. When Cappy laughs, his eyes are designed to look like the M on… https://t.co/y1tryfGXag",870
870,0.4404,Mon Jan 22 23:59:14 +0000 2018,0.0,0.861,0.139,"RT @NintendoVS: Try out new #PokemonUltraSunMoon tactics with the 2018 Championship Series format, coming to the 2018 International Challen…",871
871,0.0,Mon Jan 22 20:00:29 +0000 2018,0.0,1.0,0.0,Become a painting and travel along walls to navigate your way through Hyrule in The Legend of #Zelda: A Link Betwee… https://t.co/WwlbYiEVaX,872
872,0.9385,Mon Jan 22 18:46:18 +0000 2018,0.0,0.563,0.437,"RT @ImageForm: Yes it's TRUE! Rusty has dug his way up and will resurface on #NintendoSwitch. Our claim to fame, our wonderful pride and jo…",873
873,0.0,Mon Jan 22 18:02:28 +0000 2018,0.0,1.0,0.0,Users who sign in with a Nintendo Account when placing their votes will receive 100 Platinum Points for #MyNintendo… https://t.co/0pFYtX8XNu,874
874,0.7424,Mon Jan 22 18:01:09 +0000 2018,0.0,0.751,0.249,Round 2 of Choose Your Legends has begun! Special versions of the top-ranked Heroes will be added to #FEHeroes in t… https://t.co/v9xXII3DWZ,875
875,0.5719,Mon Jan 22 17:24:32 +0000 2018,0.0,0.837,0.163,"RT @bethesda: We’re happy to confirm our continued development partnership with @PanicButtonGame, who will be bringing Wolfenstein II to #N…",876
876,0.636,Sat Jan 20 18:40:37 +0000 2018,0.0,0.861,0.139,"RT @NintendoVS: Day two of #G5 is under way! Tune in for all of the #Splatoon2 and Super Smash Bros. tournament action:

🎥
Splatoon 2: http…",877
877,0.2023,Sat Jan 20 00:00:18 +0000 2018,0.0,0.795,0.205,So… What’s everyone playing this weekend? #NintendoSwitch https://t.co/E16hhvPqrs,878
878,0.34,Fri Jan 19 23:05:53 +0000 2018,0.057,0.833,0.11,Which Mushroom Kingdom character do you think would be good to hang out with or might be tough to hang out with? Wa… https://t.co/kO7i5VFppq,879
879,0.0,Fri Jan 19 19:00:03 +0000 2018,0.0,1.0,0.0,"Mr. Koizumi and Mr. Aonuma, the producers of #SuperMarioOdyssey and The Legend of #Zelda: Breath of the Wild are fe… https://t.co/HN9mCo6RFE",880
880,0.2244,Fri Jan 19 18:30:19 +0000 2018,0.107,0.712,0.182,RT @NintendoVS: The #ARMS Party Crash between Lola Pop and Misango is going on now! Which fighter will you choose? https://t.co/nHORpf2PlS,881
881,0.34,Fri Jan 19 18:02:06 +0000 2018,0.0,0.87,0.13,"You can play #HyruleWarriors: Definitive Edition for #NintendoSwitch anytime, anywhere, and with anyone in local 2-… https://t.co/2bm9dSou0n",882
882,-0.5267,Fri Jan 19 17:03:40 +0000 2018,0.186,0.75,0.064,"Battle your way to the top of the Cake Royale in Story Mode, or fight other Kirbys locally and online in #Kirby Bat… https://t.co/rZPEQVa0K4",883
883,0.4753,Fri Jan 19 16:11:09 +0000 2018,0.0,0.838,0.162,Five new quests and a Helpful Item pack are now available for Expansion Pass owners in #XenobladeChronicles2!… https://t.co/EC8BbIuhRf,884
884,0.2003,Fri Jan 19 15:30:05 +0000 2018,0.0,0.905,0.095,It's almost been a year since #FEHeroes launched! We're kicking off our celebrations a little early with a new Star… https://t.co/4ZmqijeWUV,885
885,-0.6114,Thu Jan 18 18:58:10 +0000 2018,0.217,0.783,0.0,Take a break from battling and check out Apple Scramble in #Kirby Battle Royale! Collect apples from Whispy Woods w… https://t.co/sB2ZcuqF0j,886
886,-0.6533,Thu Jan 18 18:00:30 +0000 2018,0.291,0.709,0.0,"Luigi may be shy, but his all-around skills let him overcome any problem! #NintendoPower https://t.co/CCYeLC48Ej",887
887,0.636,Thu Jan 18 16:00:04 +0000 2018,0.0,0.819,0.181,"Three classic Nintendo #3DS games are joining the Nintendo Selects library! Super Mario 3D Land, The Legend of Zeld… https://t.co/ETF2JgIxl5",888
888,-0.4199,Thu Jan 18 01:31:29 +0000 2018,0.285,0.528,0.187,It’s an all-out fight in #Kirby Battle Royale’s Battle Arena mode! Pick your favorite Copy Ability and get clobberi… https://t.co/3hLwUQ2EFF,889
889,0.1867,Thu Jan 18 01:02:08 +0000 2018,0.0,0.924,0.076,"Going, going…almost gone! Don't miss out on savings of up to 30% on select digital games through 8:59 a.m. PT, 1/18… https://t.co/dpazNI7fLU",890
890,0.6124,Wed Jan 17 22:30:34 +0000 2018,0.0,0.762,0.238,"Experience new ways to Make, Play and Discover as you build interactive creations with #NintendoLabo, powered by… https://t.co/9Ejmad6da6",891
891,0.3595,Tue Jan 16 21:30:05 +0000 2018,0.0,0.878,0.122,Got a question for the #NintendoPower Podcast? Share it below and we may answer it in the next episode! https://t.co/lB5MZMBEMP,892
892,0.2942,Tue Jan 16 21:00:04 +0000 2018,0.0,0.872,0.128,Are you prepared to return to Lordran? #DarkSouls: Remastered is coming to #NintendoSwitch on 5/25! https://t.co/wzSIOiz55H,893
893,0.25,Tue Jan 16 20:30:12 +0000 2018,0.123,0.723,0.154,"RT @NintendoVS: Two of the newer fighters to join #ARMS, Lola Pop and Misango, are facing off in the next Party Crash from 1/19 1 a.m. PT –…",894
894,0.3382,Tue Jan 16 20:02:36 +0000 2018,0.0,0.898,0.102,"A new Tempest Trials Mini has begun: Stepping into the New Year! There are related daily quests as well, so make su… https://t.co/PGgidniLEO",895
895,0.2714,Tue Jan 16 19:00:46 +0000 2018,0.0,0.84,0.16,Make the most of #MyNintendo with these top five tips! https://t.co/qP5W7gtPJm https://t.co/lSJtgr9zcd,896
896,0.5983,Tue Jan 16 18:01:06 +0000 2018,0.0,0.795,0.205,"Kirby gets twisting with the Tornado Copy Ability, and flips out with the Beetle Copy Ability! Check out #Kirby Bat… https://t.co/rSimPmTPtv",897
897,0.0,Tue Jan 16 17:30:04 +0000 2018,0.0,1.0,0.0,RT @LimitedRunGames: Saturday Morning RPG from our development partner @TheMightyRabbit will be coming to the Nintendo Switch both digitall…,898
898,0.3612,Tue Jan 16 17:00:32 +0000 2018,0.066,0.798,0.136,"Thanks to Funky Kong, even stages packed with hazards can be smooth surfing in #DonkeyKong Country: Tropical Freeze… https://t.co/T522gzQoPI",899
899,0.7345,Sun Jan 14 19:03:06 +0000 2018,0.0,0.676,0.324,#KirbyStarAllies will debut two new copy abilities! Unleash your creativity with the Artist ability and tangle enem… https://t.co/Fs28oUDRIQ,900
900,0.7901,Sun Jan 14 18:00:22 +0000 2018,0.0,0.72,0.28,"The global #Splatoon2 #Splatfest results are in, and #TeamComedy has taken the win, 2-1! Thanks to everyone for pla… https://t.co/tudSlQsKca",901
901,0.0,Sun Jan 14 17:30:07 +0000 2018,0.0,1.0,0.0,"With the first story mode since Mario Tennis: Power Tour on Game Boy Advance, #MarioTennis Aces offers a new flavor… https://t.co/3ECFbrPF22",902
902,0.0,Fri Jan 12 21:00:06 +0000 2018,0.0,1.0,0.0,Are you #TeamAction or #TeamComedy? The #Splatoon2 #Splatfest kicks off tonight at 8PM PT! https://t.co/cDQW7m2xCM,903
